user_input,retrieved_contexts,response,reference,context_precision,context_recall,faithfulness,answer_relevancy
Lao động nữ sinh con được nghỉ thai sản bao nhiêu tháng?,"['### Điều 139.Nghỉ thai sản**  \n1. Lao động nữ được nghỉ thai sản trước và sau khi sinh con là 06 tháng; thời gian nghỉ trước khi sinh không quá 02 tháng.  \nTrường hợp lao động nữ sinh đôi trở lên thì tính từ con thứ 02 trở đi, cứ mỗi con, người mẹ được nghỉ thêm 01 tháng.  \n2. Trong thời gian nghỉ thai sản, lao động nữ được hưởng chế độ thai sản theo quy định của pháp luật về bảo hiểm xã hội.  \n3. Hết thời gian nghỉ thai sản theo quy định tại khoản 1 Điều này, nếu có nhu cầu, lao động nữ có thể nghỉ thêm một thời gian không hưởng lương sau khi thỏa thuận với người sử dụng lao động.\n4. Trước khi hết thời gian nghỉ thai sản theo quy định tại khoản 1 Điều này, lao động nữ có thể trở lại làm việc khi đã nghỉ ít nhất được 04 tháng nhưng người lao động phải báo trước, được người sử dụng lao động đồng ý và có xác nhận của cơ sở khám bệnh, chữa bệnh có thẩm quyền về việc đi làm sớm không có hại cho sức khỏe của người lao động. Trong trường hợp này, ngoài tiền lương của những ngày làm việc do người sử dụng lao động trả, lao động nữ vẫn tiếp tục được hưởng trợ cấp thai sản theo quy định của pháp luật về bảo hiểm xã hội.  \n5. Lao động nam khi vợ sinh con, người lao động nhận nuôi con nuôi dưới 06 tháng tuổi, lao động nữ mang thai hộ và người lao động là người mẹ nhờ mang thai hộ được nghỉ việc hưởng chế độ thai sản theo quy định của pháp luật về bảo hiểm xã hội.', '### Điều 53.Thời gian nghỉ việc hưởng chế độ thai sản khi sinh con**  \n1. Thời gian nghỉ việc hưởng chế độ thai sản của lao động nữ khi sinh con được thực hiện theo quy định tại khoản 1 Điều 139 của Bộ luật Lao động.  \nTrường hợp lao động nữ trở lại làm việc trước khi hết thời gian nghỉ việc hưởng chế độ thai sản khi sinh con theo quy định tại khoản 4 Điều 139 của Bộ luật Lao động thì được hưởng tiền lương của những ngày làm việc do người sử dụng lao động trả và tiếp tục được hưởng trợ cấp thai sản theo mức quy định tại Điều 59 của Luật này; người sử dụng lao động và người lao động có trách nhiệm đóng bảo hiểm xã hội bắt buộc cho thời gian người lao động trở lại làm việc.  \n2. Lao động nam đang tham gia bảo hiểm xã hội bắt buộc khi vợ sinh con được nghỉ việc hưởng chế độ thai sản với thời gian như sau:  \na) 05 ngày làm việc;  \nb) 07 ngày làm việc khi vợ sinh con phải phẫu thuật hoặc sinh con dưới 32 tuần tuổi;\na) 05 ngày làm việc;  \nb) 07 ngày làm việc khi vợ sinh con phải phẫu thuật hoặc sinh con dưới 32 tuần tuổi;  \nc) Trường hợp vợ sinh đôi thì được nghỉ 10 ngày làm việc. Trường hợp sinh ba trở lên thì được nghỉ thêm 03 ngày làm việc cho mỗi con tính từ con thứ ba trở đi;  \nd) Trường hợp vợ sinh đôi phải phẫu thuật thì được nghỉ 14 ngày làm việc. Trường hợp sinh ba trở lên phải phẫu thuật thì được nghỉ thêm 03 ngày làm việc cho mỗi con tính từ con thứ ba trở đi.  \n3. Ngày bắt đầu nghỉ việc hưởng chế độ thai sản quy định tại khoản 2 Điều này phải trong khoảng thời gian 60 ngày kể từ ngày vợ sinh con, trường hợp người lao động nghỉ nhiều lần thì ngày bắt đầu nghỉ việc của lần cuối cùng phải trong khoảng thời gian 60 ngày đầu kể từ ngày vợ sinh con và tổng thời gian nghỉ việc hưởng chế độ thai sản không quá thời gian quy định tại khoản 2 Điều này.\n4. Trường hợp lao động nữ mang thai đôi trở lên mà khi sinh nếu có thai chết trong tử cung, thai chết trong khi chuyển dạ thì thời gian nghỉ việc hưởng chế độ thai sản và trợ cấp một lần khi sinh con được tính theo số thai bao gồm cả con sống, con chết và thai chết.  \n5. Trường hợp chỉ có mẹ hoặc cả cha và mẹ đều tham gia bảo hiểm xã hội bắt buộc mà mẹ chết sau khi sinh con thì cha hoặc người trực tiếp nuôi dưỡng được nghỉ việc hưởng chế độ thai sản để chăm sóc con đối với thời gian còn lại của người mẹ theo quy định tại khoản 1 Điều này. Trường hợp mẹ tham gia bảo hiểm xã hội bắt buộc nhưng không đủ điều kiện quy định tại khoản 2 hoặc khoản 3 hoặc khoản 5 Điều 50 của Luật này mà chết thì cha hoặc người trực tiếp nuôi dưỡng được nghỉ việc hưởng chế độ thai sản cho đến khi con đủ 06 tháng tuổi.\n6. Trường hợp cha hoặc người trực tiếp nuôi dưỡng không nghỉ việc theo quy định tại khoản 5 Điều này thì ngoài tiền lương còn được hưởng trợ cấp thai sản đối với thời gian còn lại của người mẹ kể từ ngày liền kề sau ngày người mẹ chết theo quy định tại khoản 1 Điều này.  \n7. Trường hợp chỉ có cha tham gia bảo hiểm xã hội bắt buộc mà mẹ chết sau khi sinh con hoặc gặp rủi ro sau khi sinh mà không đủ sức khỏe để chăm sóc con theo xác nhận của cơ sở khám bệnh, chữa bệnh thì cha được nghỉ việc hưởng chế độ thai sản cho đến khi con đủ 06 tháng tuổi.  \n8. Đối với trường hợp lao động nữ sinh con, người lao động nhận nuôi con nuôi dưới 06 tháng tuổi, lao động nữ mang thai hộ khi sinh con, lao động nữ nhờ mang thai hộ thì thời gian nghỉ việc hưởng chế độ thai sản được tính là thời gian đóng bảo hiểm xã hội bắt buộc, người lao động và người sử dụng lao động không phải đóng bảo hiểm xã hội.\nĐối với các trường hợp khác mà có thời gian nghỉ việc hưởng chế độ thai sản từ 14 ngày làm việc trở lên trong tháng thì thời gian này được tính là thời gian đóng bảo hiểm xã hội bắt buộc, người lao động và người sử dụng lao động không phải đóng bảo hiểm xã hội.  \n9. Thời gian nghỉ việc hưởng chế độ thai sản quy định tại các khoản 1, 4, 5, 6 và 7 Điều này tính cả ngày nghỉ lễ, tết, ngày nghỉ hằng tuần.  \n**Điều 54. Chế độ thai sản của lao động nữ mang thai hộ**  \n1. Lao động nữ mang thai hộ được nghỉ việc hưởng chế độ thai sản khi khám thai theo quy định tại Điều 51 của Luật này.  \n2. Lao động nữ mang thai hộ khi sảy thai, phá thai hoặc có thai chết trong tử cung, thai chết trong khi chuyển dạ, thai ngoài tử cung được nghỉ việc hưởng chế độ thai sản theo quy định tại Điều 52 của Luật này.  \n3. Lao động nữ mang thai hộ khi sinh con mà có đủ điều kiện quy định tại khoản 2 hoặc khoản 3 Điều 50 của Luật này được:\n3. Lao động nữ mang thai hộ khi sinh con mà có đủ điều kiện quy định tại khoản 2 hoặc khoản 3 Điều 50 của Luật này được:  \na) Nghỉ việc hưởng chế độ thai sản cho đến thời điểm giao đứa trẻ cho bên nhờ mang thai hộ nhưng không vượt quá thời gian quy định tại khoản 1 Điều 53 của Luật này.  \nTrong trường hợp kể từ ngày sinh đến thời điểm giao đứa trẻ mà thời gian hưởng chế độ thai sản chưa đủ 60 ngày thì lao động nữ mang thai hộ vẫn được hưởng chế độ thai sản cho đến khi đủ 60 ngày tính cả ngày nghỉ lễ, tết, ngày nghỉ hằng tuần. Thời điểm giao đứa trẻ cho bên nhờ mang thai hộ là thời điểm ghi trong văn bản xác nhận thời điểm giao đứa trẻ của bên nhờ mang thai hộ và bên mang thai hộ.  \nTrường hợp trước thời điểm giao nếu đứa trẻ chết mà thời gian hưởng chế độ thai sản chưa đủ 60 ngày thì lao động nữ mang thai hộ vẫn được hưởng chế độ thai sản cho đến khi đủ 60 ngày tính cả ngày nghỉ lễ, tết, ngày nghỉ hằng tuần;\nb) Trong khoảng thời gian 30 ngày đầu kể từ ngày hết thời hạn hưởng chế độ thai sản quy định tại khoản 2 Điều này và điểm a khoản này mà sức khỏe chưa phục hồi thì lao động nữ mang thai hộ được nghỉ dưỡng sức, phục hồi sức khỏe theo quy định tại Điều 60 của Luật này, trừ trường hợp lao động nữ mang thai hộ chấm dứt hợp đồng lao động, hợp đồng làm việc hoặc thôi việc trước thời điểm sinh con.  \n4. Khi lao động nữ mang thai hộ sinh con thì người chồng đang tham gia bảo hiểm xã hội bắt buộc được nghỉ việc hưởng chế độ thai sản theo quy định tại khoản 2 và khoản 3 Điều 53 của Luật này.', '## Mục 2. CHẾ ĐỘ THAI SẢN**  \n### Điều 50.Đối tượng và điều kiện hưởng chế độ thai sản**  \n1. Đối tượng quy định tại các điểm a, b, c, d, i, k, l, m và n khoản 1 và khoản 2 Điều 2 của Luật này được hưởng chế độ thai sản khi thuộc một trong các trường hợp sau đây:  \na) Lao động nữ mang thai;  \nb) Lao động nữ sinh con;  \nc) Lao động nữ mang thai hộ;  \nd) Lao động nữ nhờ mang thai hộ;  \nđ) Người lao động nhận nuôi con nuôi dưới 06 tháng tuổi;  \ne) Người lao động sử dụng các biện pháp tránh thai mà các biện pháp đó phải được thực hiện tại cơ sở khám bệnh, chữa bệnh;  \ng) Lao động nam đang tham gia bảo hiểm xã hội bắt buộc có vợ sinh con, vợ mang thai hộ sinh con.  \n2. Đối tượng quy định tại các điểm b, c, d và đ khoản 1 Điều này phải đóng bảo hiểm xã hội bắt buộc từ đủ 06 tháng trở lên trong thời gian 12 tháng liền kề trước khi sinh con hoặc nhận con khi nhờ mang thai hộ hoặc nhận nuôi con nuôi dưới 06 tháng tuổi.\n3. Đối tượng quy định tại điểm b và điểm c khoản 1 Điều này đã đóng bảo hiểm xã hội bắt buộc từ đủ 12 tháng trở lên mà khi mang thai phải nghỉ việc để dưỡng thai theo chỉ định của người hành nghề khám bệnh, chữa bệnh thuộc cơ sở khám bệnh, chữa bệnh thì phải đóng bảo hiểm xã hội bắt buộc từ đủ 03 tháng trở lên trong thời gian 12 tháng liền kề trước khi sinh con.  \n4. Đối tượng đủ điều kiện quy định tại khoản 2 hoặc khoản 3 hoặc khoản 5 Điều này mà chấm dứt hợp đồng lao động, hợp đồng làm việc hoặc thôi việc trước thời điểm sinh con hoặc nhận con khi nhờ mang thai hộ hoặc nhận nuôi con nuôi dưới 06 tháng tuổi thì vẫn được hưởng chế độ thai sản theo quy định tại các điều 53, 54, 55 và 56 và các khoản 1, 2 và 3 Điều 58 của Luật này. Thời gian hưởng chế độ thai sản không được tính là thời gian đóng bảo hiểm xã hội.\n5. Đối tượng quy định tại điểm b khoản 1 Điều này đã đóng bảo hiểm xã hội bắt buộc từ đủ 06 tháng trở lên trong thời gian 24 tháng liền kề trước khi sinh con đối với trường hợp phải nghỉ việc để điều trị vô sinh.', '### Điều 140.Bảo đảm việc làm cho lao động nghỉ thai sản**  \nLao động được bảo đảm việc làm cũ khi trở lại làm việc sau khi nghỉ hết thời gian theo quy định tại các khoản 1, 3 và 5 Điều 139 của Bộ luật này mà không bị cắt giảm tiền lương và quyền, lợi ích so với trước khi nghỉ thai sản; trường hợp việc làm cũ không còn thì người sử dụng lao động phải bố trí việc làm khác cho họ với mức lương không thấp hơn mức lương trước khi nghỉ thai sản.', '### Điều 137.Bảo vệ thai sản**  \n1. Người sử dụng lao động không được sử dụng người lao động làm việc ban đêm, làm thêm giờ và đi công tác xa trong trường hợp sau đây:  \na) Mang thai từ tháng thứ 07 hoặc từ tháng thứ 06 nếu làm việc ở vùng cao, vùng sâu, vùng xa, biên giới, hải đảo;  \nb) Đang nuôi con dưới 12 tháng tuổi, trừ trường hợp được người lao động đồng ý.  \n2. Lao động nữ làm nghề, công việc nặng nhọc, độc hại, nguy hiểm hoặc đặc biệt nặng nhọc, độc hại, nguy hiểm hoặc làm nghề, công việc có ảnh hưởng xấu tới chức năng sinh sản và nuôi con khi mang thai và có thông báo cho người sử dụng lao động biết thì được người sử dụng lao động chuyển sang làm công việc nhẹ hơn, an toàn hơn hoặc giảm bớt 01 giờ làm việc hằng ngày mà không bị cắt giảm tiền lương và quyền, lợi ích cho đến hết thời gian nuôi con dưới 12 tháng tuổi.\n3. Người sử dụng lao động không được sa thải hoặc đơn phương chấm dứt hợp đồng lao động đối với người lao động vì lý do kết hôn, mang thai, nghỉ thai sản, nuôi con dưới 12 tháng tuổi, trừ trường hợp người sử dụng lao động là cá nhân chết, bị Tòa án tuyên bố mất năng lực hành vi dân sự, mất tích hoặc đã chết hoặc người sử dụng lao động không phải là cá nhân chấm dứt hoạt động hoặc bị cơ quan chuyên môn về đăng ký kinh doanh thuộc Ủy ban nhân dân cấp tỉnh ra thông báo không có người đại diện theo pháp luật, người được ủy quyền thực hiện quyền và nghĩa vụ của người đại diện theo pháp luật.  \nTrường hợp hợp đồng lao động hết hạn trong thời gian lao động nữ mang thai hoặc nuôi con dưới 12 tháng tuổi thì được ưu tiên giao kết hợp đồng lao động mới.  \n4. Lao động nữ trong thời gian hành kinh được nghỉ mỗi ngày 30 phút, trong thời gian nuôi con dưới 12 tháng tuổi được nghỉ mỗi ngày 60 phút trong thời gian làm việc. Thời gian nghỉ vẫn được hưởng đủ tiền lương theo hợp đồng lao động.']","[TƯ_VẤN]  
1. Trả lời trực tiếp: Lao động nữ sinh con được nghỉ thai sản tổng cộng 6 tháng, trong đó thời gian nghỉ trước khi sinh không quá 2 tháng. Nếu sinh đôi trở lên, từ con thứ 2 trở đi, mỗi con được nghỉ thêm 1 tháng. Sau khi hết thời gian nghỉ thai sản này, nếu có nhu cầu, lao động nữ có thể nghỉ thêm thời gian không hưởng lương nếu thỏa thuận với người sử dụng lao động.  

2. Cơ sở pháp lý: Theo Khoản 1 Điều 139 Bộ luật Lao động 2019 quy định: ""Lao động nữ được nghỉ thai sản trước và sau khi sinh con là 06 tháng; thời gian nghỉ trước khi sinh không quá 02 tháng. Trường hợp lao động nữ sinh đôi trở lên thì tính từ con thứ 02 trở đi, cứ mỗi con, người mẹ được nghỉ thêm 01 tháng.""","Theo khoản 1 Điều 139 Bộ luật Lao động 2019, lao động nữ được nghỉ thai sản trước và sau khi sinh con là 06 tháng.",0.99999999998,1.0,1.0,0.7991826293434933
Người lao động làm thêm giờ vào ban đêm ngày lễ được trả lương như thế nào?,"['### Điều 98.Tiền lương làm thêm giờ, làm việc vào ban đêm**  \n1. Người lao động làm thêm giờ được trả lương tính theo đơn giá tiền lương hoặc tiền lương thực trả theo công việc đang làm như sau:  \na) Vào ngày thường, ít nhất bằng 150%;  \nb) Vào ngày nghỉ hằng tuần, ít nhất bằng 200%;  \nc) Vào ngày nghỉ lễ, tết, ngày nghỉ có hưởng lương, ít nhất bằng 300% chưa kể tiền lương ngày lễ, tết, ngày nghỉ có hưởng lương đối với người lao động hưởng lương ngày.  \n2. Người lao động làm việc vào ban đêm thì được trả thêm ít nhất bằng 30% tiền lương tính theo đơn giá tiền lương hoặc tiền lương thực trả theo công việc của ngày làm việc bình thường.  \n3. Người lao động làm thêm giờ vào ban đêm thì ngoài việc trả lương theo quy định tại khoản 1 và khoản 2 Điều này, người lao động còn được trả thêm 20% tiền lương tính theo đơn giá tiền lương hoặc tiền lương theo công việc làm vào ban ngày của ngày làm việc bình thường hoặc của ngày nghỉ hằng tuần hoặc của ngày nghỉ lễ, tết.\n4. Chính phủ quy định chi tiết Điều này.', '### Điều 57.Tiền lương làm thêm giờ vào ban đêm**  \nNgười lao động làm thêm giờ vào ban đêm theo khoản 3 Điều 98 của Bộ luật Lao động, được hưởng tiền lương tính theo công thức sau:  \n1. Đối với người lao động hưởng lương theo thời gian, tiền lương làm thêm giờ vào ban đêm được tính như sau:  \n|Tiền<br>lương<br>làm<br>thêm<br>=|Tiền lương<br>giờ thực trả<br>của công<br>việc đang<br>x<br>Mức ít<br>nhất<br>150%<br>hoặc<br>+<br>Tiền<br>lương giờ<br>thực trả<br>của công<br>x<br>Mức<br>ít<br>nhất<br>+<br>20<br>%x<br>Tiền lương giờ<br>vào ban ngày<br>của ngày làm<br>việc bình|<br>x<br>Số<br>giờ<br>làm<br>thêm|\n|---|---|---|  \n|giờ vào<br>ban<br>đêm|làm vào<br>ngày làm<br>việc bình<br>thường<br>200%<br>hoặc<br>300%<br>việc đang<br>làm vào<br>ngày làm<br>việc bình<br>thường<br>30%<br>thường hoặc<br>của ngày nghỉ<br>hằng tuần<br>hoặc của ngày<br>nghỉ lễ, tết,<br>ngày nghỉ có<br>hưởng lương|vào<br>ban<br>đêm|\n|---|---|---|  \nTrong đó:\n|---|---|---|  \nTrong đó:  \na) Tiền lương giờ thực trả của công việc đang làm vào ngày làm việc bình thường được xác định theo điểm a khoản 1 Điều 55 Nghị định này;  \nb) Tiền lương giờ vào ban ngày của ngày làm việc bình thường hoặc của ngày nghỉ hằng tuần hoặc của ngày nghỉ lễ, tết, ngày nghỉ có hưởng lương được xác định như sau:  \nb1) Tiền lương giờ vào ban ngày của ngày làm việc bình thường, được tính ít nhất bằng 100% so với tiền lương giờ thực trả của công việc đang làm vào ngày làm việc bình thường đối với trường hợp người lao động không làm thêm giờ vào ban ngày của ngày đó (trước khi làm thêm giờ vào ban đêm); ít nhất bằng 150% so với tiền lương giờ thực trả của công việc đang làm vào ngày làm việc bình thường đối với trường hợp người lao động có làm thêm giờ vào ban ngày của ngày đó (trước khi làm thêm giờ vào ban đêm);\nb2) Tiền lương giờ vào ban ngày của ngày nghỉ hằng tuần, được tính ít nhất bằng 200% so với tiền lương giờ thực trả của công việc đang làm vào ngày làm việc bình thường;  \nb3) Tiền lương giờ vào ban ngày của ngày nghỉ lễ, tết, ngày nghỉ có hưởng lương, được tính ít nhất bằng 300% so với tiền lương giờ thực trả của công việc đang làm vào ngày làm việc bình thường.  \n2. Đối với người lao động hưởng lương theo sản phẩm, tiền lương làm thêm giờ vào ban đêm được tính như sau:\n2. Đối với người lao động hưởng lương theo sản phẩm, tiền lương làm thêm giờ vào ban đêm được tính như sau:  \n|Tiền<br>lương<br>làm<br>thêm<br>giờ<br>vào<br>ban<br>đêm<br>=|Đơn giá<br>tiền<br>lương<br>sản<br>phẩm<br>của ngày<br>làm việc<br>bình<br>thường<br>x<br>Mức ít<br>nhất<br>150%<br>hoặc<br>200%<br>hoặc<br>300%<br>+<br>Đơn giá<br>tiền lương<br>sản phẩm<br>của ngày<br>làm việc<br>bình<br>thường<br>x<br>Mức<br>ít<br>nhất<br>30%<br>+ 20% x<br>Đơn giá tiền<br>lương sản phẩm<br>vào ban ngày của<br>ngày làm việc<br>bình thường hoặc<br>của ngày nghỉ<br>hằng tuần hoặc<br>của ngày nghỉ lễ,<br>tết, ngày nghỉ có<br>hưởng lương|x<br>Số sản<br>phẩm<br>làm<br>thêm<br>vào<br>ban<br>đêm|\n|---|---|---|  \nTrong đó, đơn giá tiền lương sản phẩm vào ban ngày của ngày làm việc bình thường hoặc của ngày nghỉ hằng tuần hoặc của ngày nghỉ lễ, tết, ngày nghỉ có hưởng lương được xác định như sau:\na) Đơn giá tiền lương sản phẩm vào ban ngày của ngày làm việc bình thường, được tính ít nhất bằng 100% so với đơn giá tiền lương sản phẩm của ngày làm việc bình thường đối với trường hợp người lao động không làm thêm giờ vào ban ngày của ngày đó (trước khi làm thêm giờ vào ban đêm); ít nhất bằng 150% so với đơn giá tiền lương sản phẩm của ngày làm việc bình thường đối với trường hợp người lao động có làm thêm giờ vào ban ngày của ngày đó (trước khi làm thêm giờ vào ban đêm);  \nb) Đơn giá tiền lương sản phẩm vào ban ngày của ngày nghỉ hằng tuần, được tính ít nhất bằng 200% so với đơn giá tiền lương sản phẩm của ngày làm việc bình thường;  \nc) Đơn giá tiền lương sản phẩm vào ban ngày của ngày nghỉ lễ, tết, ngày nghỉ có hưởng lương, được tính ít nhất 300% so với đơn giá tiền lương sản phẩm của ngày làm việc bình thường.', '### Điều 56.Tiền lương làm việc vào ban đêm**  \nTiền lương làm việc vào ban đêm theo khoản 2 Điều 98 của Bộ luật Lao động, được tính theo công thức sau:  \n1. Đối với người lao động hưởng lương theo thời gian, tiền lương làm việc vào ban đêm được tính như sau:  \n|Tiền<br>lương<br>làm việc<br>vào ban<br>đêm<br>=|Tiền lương giờ thực<br>trả của công việc<br>đang làm vào ngày<br>làm việc bình thường<br>+<br>Tiền lương giờ<br>thực trả của công<br>việc đang làm vào<br>ngày làm việc bình<br>thường<br>x<br>Mức ít nhất<br>30%|x<br>Số giờ<br>làm việc<br>vào ban<br>đêm|\n|---|---|---|  \nTrong đó: Tiền lương giờ thực trả của công việc đang làm vào ngày làm việc bình thường được xác định theo điểm a khoản 1 Điều 55 Nghị định này.  \n2. Đối với người lao động hưởng lương theo sản phẩm, tiền lương làm việc vào ban đêm được tính như sau:\n2. Đối với người lao động hưởng lương theo sản phẩm, tiền lương làm việc vào ban đêm được tính như sau:  \n|Tiền lương<br>làm việc<br>vào ban<br>đêm<br>=<br>|Đơn giá tiền<br>lương sản<br>phẩm của ngày<br>làm việc bình<br>thường<br>+<br>Đơn giá tiền<br>lương sản phẩm<br>của ngày làm<br>việc bình thường<br>x<br>Mức ít<br>nhất<br>30%<br>|x<br>Số sản<br>phẩm làm<br>vào ban<br>đêm|\n|---|---|---|', '### Điều 106.Giờ làm việc ban đêm**  \nGiờ làm việc ban đêm được tính từ 22 giờ đến 06 giờ sáng ngày hôm sau.', '### Điều 107.Làm thêm giờ**  \n1. Thời gian làm thêm giờ là khoảng thời gian làm việc ngoài thời giờ làm việc bình thường theo quy định của pháp luật, thỏa ước lao động tập thể hoặc nội quy lao động.  \n2. Người sử dụng lao động được sử dụng người lao động làm thêm giờ khi đáp ứng đầy đủ các yêu cầu sau đây:  \na) Phải được sự đồng ý của người lao động;  \nb) Bảo đảm số giờ làm thêm của người lao động không quá 50% số giờ làm việc bình thường trong 01 ngày; trường hợp áp dụng quy định thời giờ làm việc bình thường theo tuần thì tổng số giờ làm việc bình thường và số giờ làm thêm không quá 12 giờ trong 01 ngày; không quá 40 giờ trong 01 tháng;  \nc) Bảo đảm số giờ làm thêm của người lao động không quá 200 giờ trong 01 năm, trừ trường hợp quy định tại khoản 3 Điều này.  \n3. Người sử dụng lao động được sử dụng người lao động làm thêm không quá 300 giờ trong 01 năm trong một số ngành, nghề, công việc hoặc trường hợp sau đây:\na) Sản xuất, gia công xuất khẩu sản phẩm hàng dệt, may, da, giày, điện, điện tử, chế biến nông, lâm, diêm nghiệp, thủy sản;  \nb) Sản xuất, cung cấp điện, viễn thông, lọc dầu; cấp, thoát nước;  \nc) Trường hợp giải quyết công việc đòi hỏi lao động có trình độ chuyên môn, kỹ thuật cao mà thị trường lao động không cung ứng đầy đủ, kịp thời;  \nd) Trường hợp phải giải quyết công việc cấp bách, không thể trì hoãn do tính chất thời vụ, thời điểm của nguyên liệu, sản phẩm hoặc để giải quyết công việc phát sinh do yếu tố khách quan không dự liệu trước, do hậu quả thời tiết, thiên tai, hỏa hoạn, địch họa, thiếu điện, thiếu nguyên liệu, sự cố kỹ thuật của dây chuyền sản xuất;  \nđ) Trường hợp khác do Chính phủ quy định.  \n4. Khi tổ chức làm thêm giờ theo quy định tại khoản 3 Điều này, người sử dụng lao động phải thông báo bằng văn bản cho cơ quan chuyên môn về lao động thuộc Ủy ban nhân dân cấp tỉnh.  \n5. Chính phủ quy định chi tiết Điều này.']","[TƯ_VẤN]  
1. Trả lời trực tiếp: Người lao động làm thêm giờ vào ban đêm ngày lễ được trả lương theo công thức đặc biệt, bao gồm:  
- Tiền lương làm thêm giờ vào ngày lễ ít nhất bằng 300% tiền lương ngày làm việc bình thường (theo khoản 1 Điều 98 Bộ luật Lao động 2019).  
- Tiền lương làm việc vào ban đêm được trả thêm ít nhất 30% tiền lương ngày làm việc bình thường (khoản 2 Điều 98).  
- Ngoài ra, làm thêm giờ vào ban đêm còn được trả thêm 20% tiền lương tính theo đơn giá tiền lương hoặc tiền lương theo công việc làm vào ban ngày của ngày lễ (khoản 3 Điều 98).  

Tổng hợp lại, tiền lương làm thêm giờ vào ban đêm ngày lễ bao gồm:  
- Tiền lương làm thêm giờ ngày lễ (ít nhất 300%)  
- Tiền lương làm việc ban đêm (ít nhất 30%)  
- Tiền lương phụ trội thêm 20% theo khoản 3 Điều 98  

Cách tính chi tiết được quy định tại Điều 57 Nghị định hướng dẫn, trong đó tiền lương làm thêm giờ vào ban đêm ngày lễ được tính theo công thức:  
Tiền lương làm thêm giờ ban đêm = (Tiền lương giờ thực trả x mức ít nhất 300%) + (Tiền lương giờ thực trả x mức ít nhất 30%) + (20% x Tiền lương giờ vào ban ngày của ngày lễ) x số giờ làm thêm vào ban đêm.  

2. Cơ sở pháp lý:  
- Khoản 1, 2, 3 Điều 98 Bộ luật Lao động 2019 quy định về tiền lương làm thêm giờ, làm việc vào ban đêm và mức trả lương tương ứng.  
- Điều 57 Nghị định hướng dẫn chi tiết về tiền lương làm thêm giờ vào ban đêm, trong đó có công thức tính cụ thể cho trường hợp làm thêm giờ vào ban đêm ngày lễ.  
- Điều 106 Bộ luật Lao động 2019 xác định giờ làm việc ban đêm từ 22 giờ đến 6 giờ sáng ngày hôm sau.  

Như vậy, người lao động làm thêm giờ vào ban đêm ngày lễ được hưởng mức lương rất ưu đãi, đảm bảo quyền lợi theo quy định pháp luật.","Được trả ít nhất 300% lương ngày lễ, cộng thêm 30% lương làm đêm, cộng thêm 20% tiền lương tính theo đơn giá tiền lương hoặc tiền lương thực trả theo công việc làm vào ban ngày của ngày làm việc bình thường hoặc của ngày nghỉ hằng tuần hoặc của ngày nghỉ lễ, tết.",0.94999999997625,1.0,0.7777777777777778,0.8228134164013823
"Thử việc tối đa bao nhiêu ngày đối với công việc có chức danh nghề nghiệp cần trình độ chuyên môn, kỹ thuật từ cao đẳng trở lên?","['### Điều 25.Thời gian thử việc**  \nThời gian thử việc do hai bên thỏa thuận căn cứ vào tính chất và mức độ phức tạp của công việc nhưng chỉ được thử việc một lần đối với một công việc và bảo đảm điều kiện sau đây:  \n1. Không quá 180 ngày đối với công việc của người quản lý doanh nghiệp theo quy định của Luật Doanh nghiệp, Luật Quản lý, sử dụng vốn nhà nước đầu tư vào sản xuất, kinh doanh tại doanh nghiệp;  \n2. Không quá 60 ngày đối với công việc có chức danh nghề nghiệp cần trình độ chuyên môn, kỹ thuật từ cao đẳng trở lên;  \n3. Không quá 30 ngày đối với công việc có chức danh nghề nghiệp cần trình độ chuyên môn, kỹ thuật trung cấp, công nhân kỹ thuật, nhân viên nghiệp vụ;  \n4. Không quá 06 ngày làm việc đối với công việc khác.', '### Điều 65.Thời gian được coi là thời gian làm việc để tính số ngày nghỉ hằng năm của người lao động**  \n1. Thời gian học nghề, tập nghề theo quy định tại Điều 61 của Bộ luật Lao động nếu sau khi hết thời gian học nghề, tập nghề mà người lao động làm việc cho người sử dụng lao động.  \n2. Thời gian thử việc nếu người lao động tiếp tục làm việc cho người sử dụng lao động sau khi hết thời gian thử việc.  \n3. Thời gian nghỉ việc riêng có hưởng lương theo khoản 1 Điều 115 của Bộ luật Lao động.  \n4. Thời gian nghỉ việc không hưởng lương nếu được người sử dụng lao động đồng ý nhưng cộng dồn không quá 01 tháng trong một năm.  \n5. Thời gian nghỉ do tai nạn lao động, bệnh nghề nghiệp nhưng cộng dồn không quá 6 tháng.  \n6. Thời gian nghỉ do ốm đau nhưng cộng dồn không quá 02 tháng trong một năm.  \n7. Thời gian nghỉ hưởng chế độ thai sản theo quy định của pháp luật về bảo hiểm xã hội.\n7. Thời gian nghỉ hưởng chế độ thai sản theo quy định của pháp luật về bảo hiểm xã hội.  \n8. Thời gian thực hiện các nhiệm vụ của tổ chức đại diện người lao động tại cơ sở mà được tính là thời gian làm việc theo quy định của pháp luật.  \n9. Thời gian phải ngừng việc, nghỉ việc không do lỗi của người lao động.  \n10. Thời gian nghỉ vì bị tạm đình chỉ công việc nhưng sau đó được kết luận là không vi phạm hoặc không bị xử lý kỷ luật lao động.', '### Điều 61.Học nghề, tập nghề để làm việc cho người sử dụng lao động**  \n1. Học nghề để làm việc cho người sử dụng lao động là việc người sử dụng lao động tuyển người vào để đào tạo nghề nghiệp tại nơi làm việc. Thời gian học nghề theo chương trình đào tạo của từng trình độ theo quy định của Luật Giáo dục nghề nghiệp.  \n2. Tập nghề để làm việc cho người sử dụng lao động là việc người sử dụng lao động tuyển người vào để hướng dẫn thực hành công việc, tập làm nghề theo vị trí việc làm tại nơi làm việc. Thời hạn tập nghề không quá 03 tháng.  \n3. Người sử dụng lao động tuyển người vào học nghề, tập nghề để làm việc cho mình thì không phải đăng ký hoạt động giáo dục nghề nghiệp; không được thu học phí; phải ký hợp đồng đào tạo theo quy định của Luật Giáo dục nghề nghiệp.\n4. Người học nghề, người tập nghề phải đủ 14 tuổi trở lên và phải có đủ sức khỏe phù hợp với yêu cầu học nghề, tập nghề. Người học nghề, người tập nghề thuộc danh mục nghề, công việc nặng nhọc, độc hại, nguy hiểm hoặc đặc biệt nặng nhọc, độc hại, nguy hiểm do Bộ trưởng Bộ Lao động - Thương binh và Xã hội ban hành phải từ đủ 18 tuổi trở lên, trừ lĩnh vực nghệ thuật, thể dục, thể thao.  \n5. Trong thời gian học nghề, tập nghề, nếu người học nghề, người tập nghề trực tiếp hoặc tham gia lao động thì được người sử dụng lao động trả lương theo mức do hai bên thỏa thuận.  \n6. Hết thời hạn học nghề, tập nghề, hai bên phải ký kết hợp đồng lao động khi đủ các điều kiện theo quy định của Bộ luật này.']","[TƯ_VẤN]  
1. Trả lời trực tiếp: Thời gian thử việc tối đa đối với công việc có chức danh nghề nghiệp cần trình độ chuyên môn, kỹ thuật từ cao đẳng trở lên là không quá 60 ngày.  

2. Cơ sở pháp lý: Theo Khoản 2 Điều 25 Bộ luật Lao động 2019 quy định: ""Không quá 60 ngày đối với công việc có chức danh nghề nghiệp cần trình độ chuyên môn, kỹ thuật từ cao đẳng trở lên.""","Không quá 60 ngày đối với công việc có chức danh nghề nghiệp cần trình độ chuyên môn, kỹ thuật từ cao đẳng trở lên theo Điều 27 Bộ luật Lao động 2019.",0.9999999999,0.5,1.0,0.7849056253480589
Bao nhiêu tuổi thì được coi là người lao động cao tuổi?,"['## Mục 2. NGƯỜI LAO ĐỘNG CAO TUỔI**  \n### Điều 148.Người lao động cao tuổi**  \n1. Người lao động cao tuổi là người tiếp tục lao động sau độ tuổi theo quy định tại khoản 2 Điều 169 của Bộ luật này.  \n2. Người lao động cao tuổi có quyền thỏa thuận với người sử dụng lao động về việc rút ngắn thời giờ làm việc hằng ngày hoặc áp dụng chế độ làm việc không trọn thời gian.  \n3. Nhà nước khuyến khích sử dụng người lao động cao tuổi làm việc phù hợp với sức khỏe để bảo đảm quyền lao động và sử dụng hiệu quả nguồn nhân lực.', '### Điều 169.Tuổi nghỉ hưu**  \n1. Người lao động bảo đảm điều kiện về thời gian đóng bảo hiểm xã hội theo quy định của pháp luật về bảo hiểm xã hội được hưởng lương hưu khi đủ tuổi nghỉ hưu.  \n2. Tuổi nghỉ hưu của người lao động trong điều kiện lao động bình thường được điều chỉnh theo lộ trình cho đến khi đủ 62 tuổi đối với lao động nam vào năm 2028 và đủ 60 tuổi đối với lao động nữ vào năm 2035.  \nKể từ năm 2021, tuổi nghỉ hưu của người lao động trong điều kiện lao động bình thường là đủ 60 tuổi 03 tháng đối với lao động nam và đủ 55 tuổi 04 tháng đối với lao động nữ; sau đó, cứ mỗi năm tăng thêm 03 tháng đối với lao động nam và 04 tháng đối với lao động nữ.\n3. Người lao động bị suy giảm khả năng lao động; làm nghề, công việc đặc biệt nặng nhọc, độc hại, nguy hiểm; làm nghề, công việc nặng nhọc, độc hại, nguy hiểm; làm việc ở vùng có điều kiện kinh tế - xã hội đặc biệt khó khăn có thể nghỉ hưu ở tuổi thấp hơn nhưng không quá 05 tuổi so với quy định tại khoản 2 Điều này tại thời điểm nghỉ hưu, trừ trường hợp pháp luật có quy định khác.  \n4. Người lao động có trình độ chuyên môn, kỹ thuật cao và một số trường hợp đặc biệt có thể nghỉ hưu ở tuổi cao hơn nhưng không quá 05 tuổi so với quy định tại khoản 2 Điều này tại thời điểm nghỉ hưu, trừ trường hợp pháp luật có quy định khác.  \n5. Chính phủ quy định chi tiết Điều này.', '### Điều 149.Sử dụng người lao động cao tuổi**  \n1. Khi sử dụng người lao động cao tuổi, hai bên có thể thỏa thuận giao kết nhiều lần hợp đồng lao động xác định thời hạn.  \n2. Khi người lao động cao tuổi đang hưởng lương hưu theo quy định của Luật Bảo hiểm xã hội mà làm việc theo hợp đồng lao động mới thì ngoài quyền lợi đang hưởng theo chế độ hưu trí, người lao động cao tuổi được hưởng tiền lương và các quyền lợi khác theo quy định của pháp luật, hợp đồng lao động.  \n3. Không được sử dụng người lao động cao tuổi làm nghề, công việc nặng nhọc, độc hại, nguy hiểm hoặc đặc biệt nặng nhọc, độc hại, nguy hiểm có ảnh hưởng xấu tới sức khỏe người lao động cao tuổi, trừ trường hợp bảo đảm các điều kiện làm việc an toàn.  \n4. Người sử dụng lao động có trách nhiệm quan tâm chăm sóc sức khỏe của người lao động cao tuổi tại nơi làm việc.']","[TƯ_VẤN]  
1. Trả lời trực tiếp: Người lao động cao tuổi là người tiếp tục lao động sau độ tuổi nghỉ hưu theo quy định tại khoản 2 Điều 169 Bộ luật Lao động 2019. Cụ thể, độ tuổi nghỉ hưu hiện tại được điều chỉnh theo lộ trình đến năm 2028 là đủ 62 tuổi đối với lao động nam và đến năm 2035 là đủ 60 tuổi đối với lao động nữ. Như vậy, người lao động nam trên 62 tuổi và nữ trên 60 tuổi (theo lộ trình) được coi là người lao động cao tuổi khi tiếp tục làm việc.  

2. Cơ sở pháp lý: Theo Khoản 1 Điều 148 Bộ luật Lao động 2019 quy định: ""Người lao động cao tuổi là người tiếp tục lao động sau độ tuổi theo quy định tại khoản 2 Điều 169 của Bộ luật này."" Và Khoản 2 Điều 169 Bộ luật Lao động 2019 quy định tuổi nghỉ hưu cụ thể cho lao động nam và nữ.",Người lao động cao tuổi là người tiếp tục lao động sau độ tuổi nghỉ hưu theo quy định tại khoản 2 Điều 169 của Bộ luật Lao động.,0.99999999995,1.0,0.6666666666666666,0.7824465006423997
Người lao động đơn phương chấm dứt hợp đồng lao động không xác định thời hạn phải báo trước bao nhiêu ngày?,"['### Điều 35.Quyền đơn phương chấm dứt hợp đồng lao động của người lao động**  \n1. Người lao động có quyền đơn phương chấm dứt hợp đồng lao động nhưng phải báo trước cho người sử dụng lao động như sau:  \na) Ít nhất 45 ngày nếu làm việc theo hợp đồng lao động không xác định thời hạn;  \nb) Ít nhất 30 ngày nếu làm việc theo hợp đồng lao động xác định thời hạn có thời hạn từ 12 tháng đến 36 tháng;  \nc) Ít nhất 03 ngày làm việc nếu làm việc theo hợp đồng lao động xác định thời hạn có thời hạn dưới 12 tháng;  \nd) Đối với một số ngành, nghề, công việc đặc thù thì thời hạn báo trước được thực hiện theo quy định của Chính phủ.  \n2. Người lao động có quyền đơn phương chấm dứt hợp đồng lao động không cần báo trước trong trường hợp sau đây:  \na) Không được bố trí theo đúng công việc, địa điểm làm việc hoặc không được bảo đảm điều kiện làm việc theo thỏa thuận, trừ trường hợp quy định tại Điều 29 của Bộ luật này;\nb) Không được trả đủ lương hoặc trả lương không đúng thời hạn, trừ trường hợp quy định tại khoản 4 Điều 97 của Bộ luật này;  \nc) Bị người sử dụng lao động ngược đãi, đánh đập hoặc có lời nói, hành vi nhục mạ, hành vi làm ảnh hưởng đến sức khỏe, nhân phẩm, danh dự; bị cưỡng bức lao động;  \nd) Bị quấy rối tình dục tại nơi làm việc;  \nđ) Lao động nữ mang thai phải nghỉ việc theo quy định tại khoản 1 Điều 138 của Bộ luật này;  \ne) Đủ tuổi nghỉ hưu theo quy định tại Điều 169 của Bộ luật này, trừ trường hợp các bên có thỏa thuận khác;  \ng) Người sử dụng lao động cung cấp thông tin không trung thực theo quy định tại khoản 1 Điều 16 của Bộ luật này làm ảnh hưởng đến việc thực hiện hợp đồng lao động.', '### Điều 162.Hợp đồng lao động đối với lao động là người giúp việc gia đình**  \n1. Người sử dụng lao động phải giao kết hợp đồng lao động bằng văn bản với lao động là người giúp việc gia đình.  \n2. Thời hạn của hợp đồng lao động đối với lao động là người giúp việc gia đình do hai bên thỏa thuận. Một bên có quyền đơn phương chấm dứt hợp đồng lao động bất kỳ khi nào nhưng phải báo trước ít nhất 15 ngày.  \n3. Hai bên thỏa thuận trong hợp đồng lao động về hình thức trả lương, kỳ hạn trả lương, thời giờ làm việc hằng ngày, chỗ ở.', '### Điều 38.Hủy bỏ việc đơn phương chấm dứt hợp đồng lao động**  \nMỗi bên đều có quyền hủy bỏ việc đơn phương chấm dứt hợp đồng lao động trước khi hết thời hạn báo trước nhưng phải thông báo bằng văn bản và phải được bên kia đồng ý.', '### Điều 36.Quyền đơn phương chấm dứt hợp đồng lao động của người sử dụng lao động**  \n1. Người sử dụng lao động có quyền đơn phương chấm dứt hợp đồng lao động trong trường hợp sau đây:  \na) Người lao động thường xuyên không hoàn thành công việc theo hợp đồng lao động được xác định theo tiêu chí đánh giá mức độ hoàn thành công việc trong quy chế của người sử dụng lao động. Quy chế đánh giá mức độ hoàn thành công việc do người sử dụng lao động ban hành nhưng phải tham khảo ý kiến tổ chức đại diện người lao động tại cơ sở đối với nơi có tổ chức đại diện người lao động tại cơ sở;\nb) Người lao động bị ốm đau, tai nạn đã điều trị 12 tháng liên tục đối với người làm việc theo hợp đồng lao động không xác định thời hạn hoặc đã điều trị 06 tháng liên tục đối với người làm việc theo hợp đồng lao động xác định thời hạn có thời hạn từ 12 tháng đến 36 tháng hoặc quá nửa thời hạn hợp đồng lao động đối với người làm việc theo hợp đồng lao động xác định thời hạn có thời hạn dưới 12 tháng mà khả năng lao động chưa hồi phục.  \nKhi sức khỏe của người lao động bình phục thì người sử dụng lao động xem xét để tiếp tục giao kết hợp đồng lao động với người lao động;  \nc) Do thiên tai, hỏa hoạn, dịch bệnh nguy hiểm, địch họa hoặc di dời, thu hẹp sản xuất, kinh doanh theo yêu cầu của cơ quan nhà nước có thẩm quyền mà người sử dụng lao động đã tìm mọi biện pháp khắc phục nhưng vẫn buộc phải giảm chỗ làm việc;  \nd) Người lao động không có mặt tại nơi làm việc sau thời hạn quy định tại Điều 31 của Bộ luật này;\nd) Người lao động không có mặt tại nơi làm việc sau thời hạn quy định tại Điều 31 của Bộ luật này;  \nđ) Người lao động đủ tuổi nghỉ hưu theo quy định tại Điều 169 của Bộ luật này, trừ trường hợp có thỏa thuận khác;  \ne) Người lao động tự ý bỏ việc mà không có lý do chính đáng từ 05 ngày làm việc liên tục trở lên;  \ng) Người lao động cung cấp không trung thực thông tin theo quy định tại khoản 2 Điều 16 của Bộ luật này khi giao kết hợp đồng lao động làm ảnh hưởng đến việc tuyển dụng người lao động.  \n2. Khi đơn phương chấm dứt hợp đồng lao động trong trường hợp quy định tại các điểm a, b, c, đ và g khoản 1 Điều này, người sử dụng lao động phải báo trước cho người lao động như sau:  \na) Ít nhất 45 ngày đối với hợp đồng lao động không xác định thời hạn;  \nb) Ít nhất 30 ngày đối với hợp đồng lao động xác định thời hạn có thời hạn từ 12 tháng đến 36 tháng;\nb) Ít nhất 30 ngày đối với hợp đồng lao động xác định thời hạn có thời hạn từ 12 tháng đến 36 tháng;  \nc) Ít nhất 03 ngày làm việc đối với hợp đồng lao động xác định thời hạn có thời hạn dưới 12 tháng và đối với trường hợp quy định tại điểm b khoản 1 Điều này;  \nd) Đối với một số ngành, nghề, công việc đặc thù thì thời hạn báo trước được thực hiện theo quy định của Chính phủ.  \n3. Khi đơn phương chấm dứt hợp đồng lao động quy định tại điểm d và điểm e khoản 1 Điều này thì người sử dụng lao động không phải báo trước cho người lao động.']","[TƯ_VẤN]  
1. Trả lời trực tiếp: Người lao động đơn phương chấm dứt hợp đồng lao động không xác định thời hạn phải báo trước cho người sử dụng lao động ít nhất 45 ngày.  

2. Cơ sở pháp lý: Theo Khoản 1 Điều 35 Bộ luật Lao động 2019 quy định: ""Người lao động có quyền đơn phương chấm dứt hợp đồng lao động nhưng phải báo trước cho người sử dụng lao động như sau: a) Ít nhất 45 ngày nếu làm việc theo hợp đồng lao động không xác định thời hạn"".",Phải báo trước ít nhất 45 ngày theo quy định tại điểm a khoản 1 Điều 35 Bộ luật Lao động 2019.,0.7499999999625,1.0,0.5,0.8104152148538749
