user_input,retrieved_contexts,response,reference,context_precision,context_recall,faithfulness,answer_relevancy
Lao động nữ sinh con được nghỉ thai sản bao nhiêu tháng?,"['### Điều 139.Nghỉ thai sản**  \n1. Lao động nữ được nghỉ thai sản trước và sau khi sinh con là 06 tháng; thời gian nghỉ trước khi sinh không quá 02 tháng.  \nTrường hợp lao động nữ sinh đôi trở lên thì tính từ con thứ 02 trở đi, cứ mỗi con, người mẹ được nghỉ thêm 01 tháng.  \n2. Trong thời gian nghỉ thai sản, lao động nữ được hưởng chế độ thai sản theo quy định của pháp luật về bảo hiểm xã hội.  \n3. Hết thời gian nghỉ thai sản theo quy định tại khoản 1 Điều này, nếu có nhu cầu, lao động nữ có thể nghỉ thêm một thời gian không hưởng lương sau khi thỏa thuận với người sử dụng lao động.  \n4. Trước khi hết thời gian nghỉ thai sản theo quy định tại khoản 1 Điều này, lao động nữ có thể trở lại làm việc khi đã nghỉ ít nhất được 04 tháng nhưng người lao động phải báo trước, được người sử dụng lao động đồng ý và có xác nhận của cơ sở khám bệnh, chữa bệnh có thẩm quyền về việc đi làm sớm không có hại cho sức khỏe của người lao động. Trong trường hợp này, ngoài tiền lương của những ngày làm việc do người sử dụng lao động trả, lao động nữ vẫn tiếp tục được hưởng trợ cấp thai sản theo quy định của pháp luật về bảo hiểm xã hội.  \n5. Lao động nam khi vợ sinh con, người lao động nhận nuôi con nuôi dưới 06 tháng tuổi, lao động nữ mang thai hộ và người lao động là người mẹ nhờ mang thai hộ được nghỉ việc hưởng chế độ thai sản theo quy định của pháp luật về bảo hiểm xã hội.', '### Điều 53.Thời gian nghỉ việc hưởng chế độ thai sản khi sinh con**  \n1. Thời gian nghỉ việc hưởng chế độ thai sản của lao động nữ khi sinh con được thực hiện theo quy định tại khoản 1 Điều 139 của Bộ luật Lao động.  \nTrường hợp lao động nữ trở lại làm việc trước khi hết thời gian nghỉ việc hưởng chế độ thai sản khi sinh con theo quy định tại khoản 4 Điều 139 của Bộ luật Lao động thì được hưởng tiền lương của những ngày làm việc do người sử dụng lao động trả và tiếp tục được hưởng trợ cấp thai sản theo mức quy định tại Điều 59 của Luật này; người sử dụng lao động và người lao động có trách nhiệm đóng bảo hiểm xã hội bắt buộc cho thời gian người lao động trở lại làm việc.  \n2. Lao động nam đang tham gia bảo hiểm xã hội bắt buộc khi vợ sinh con được nghỉ việc hưởng chế độ thai sản với thời gian như sau:  \na) 05 ngày làm việc;  \nb) 07 ngày làm việc khi vợ sinh con phải phẫu thuật hoặc sinh con dưới 32 tuần tuổi;  \nc) Trường hợp vợ sinh đôi thì được nghỉ 10 ngày làm việc. Trường hợp sinh ba trở lên thì được nghỉ thêm 03 ngày làm việc cho mỗi con tính từ con thứ ba trở đi;  \nd) Trường hợp vợ sinh đôi phải phẫu thuật thì được nghỉ 14 ngày làm việc. Trường hợp sinh ba trở lên phải phẫu thuật thì được nghỉ thêm 03 ngày làm việc cho mỗi con tính từ con thứ ba trở đi.  \n3. Ngày bắt đầu nghỉ việc hưởng chế độ thai sản quy định tại khoản 2 Điều này phải trong khoảng thời gian 60 ngày kể từ ngày vợ sinh con, trường hợp người lao động nghỉ nhiều lần thì ngày bắt đầu nghỉ việc của lần cuối cùng phải trong khoảng thời gian 60 ngày đầu kể từ ngày vợ sinh con và tổng thời gian nghỉ việc hưởng chế độ thai sản không quá thời gian quy định tại khoản 2 Điều này.  \n4. Trường hợp lao động nữ mang thai đôi trở lên mà khi sinh nếu có thai chết trong tử cung, thai chết trong khi chuyển dạ thì thời gian nghỉ việc hưởng chế độ thai sản và trợ cấp một lần khi sinh con được tính theo số thai bao gồm cả con sống, con chết và thai chết.\n4. Trường hợp lao động nữ mang thai đôi trở lên mà khi sinh nếu có thai chết trong tử cung, thai chết trong khi chuyển dạ thì thời gian nghỉ việc hưởng chế độ thai sản và trợ cấp một lần khi sinh con được tính theo số thai bao gồm cả con sống, con chết và thai chết.  \n5. Trường hợp chỉ có mẹ hoặc cả cha và mẹ đều tham gia bảo hiểm xã hội bắt buộc mà mẹ chết sau khi sinh con thì cha hoặc người trực tiếp nuôi dưỡng được nghỉ việc hưởng chế độ thai sản để chăm sóc con đối với thời gian còn lại của người mẹ theo quy định tại khoản 1 Điều này. Trường hợp mẹ tham gia bảo hiểm xã hội bắt buộc nhưng không đủ điều kiện quy định tại khoản 2 hoặc khoản 3 hoặc khoản 5 Điều 50 của Luật này mà chết thì cha hoặc người trực tiếp nuôi dưỡng được nghỉ việc hưởng chế độ thai sản cho đến khi con đủ 06 tháng tuổi.  \n6. Trường hợp cha hoặc người trực tiếp nuôi dưỡng không nghỉ việc theo quy định tại khoản 5 Điều này thì ngoài tiền lương còn được hưởng trợ cấp thai sản đối với thời gian còn lại của người mẹ kể từ ngày liền kề sau ngày người mẹ chết theo quy định tại khoản 1 Điều này.  \n7. Trường hợp chỉ có cha tham gia bảo hiểm xã hội bắt buộc mà mẹ chết sau khi sinh con hoặc gặp rủi ro sau khi sinh mà không đủ sức khỏe để chăm sóc con theo xác nhận của cơ sở khám bệnh, chữa bệnh thì cha được nghỉ việc hưởng chế độ thai sản cho đến khi con đủ 06 tháng tuổi.  \n8. Đối với trường hợp lao động nữ sinh con, người lao động nhận nuôi con nuôi dưới 06 tháng tuổi, lao động nữ mang thai hộ khi sinh con, lao động nữ nhờ mang thai hộ thì thời gian nghỉ việc hưởng chế độ thai sản được tính là thời gian đóng bảo hiểm xã hội bắt buộc, người lao động và người sử dụng lao động không phải đóng bảo hiểm xã hội.  \nĐối với các trường hợp khác mà có thời gian nghỉ việc hưởng chế độ thai sản từ 14 ngày làm việc trở lên trong tháng thì thời gian này được tính là thời gian đóng bảo hiểm xã hội bắt buộc, người lao động và người sử dụng lao động không phải đóng bảo hiểm xã hội.\nĐối với các trường hợp khác mà có thời gian nghỉ việc hưởng chế độ thai sản từ 14 ngày làm việc trở lên trong tháng thì thời gian này được tính là thời gian đóng bảo hiểm xã hội bắt buộc, người lao động và người sử dụng lao động không phải đóng bảo hiểm xã hội.  \n9. Thời gian nghỉ việc hưởng chế độ thai sản quy định tại các khoản 1, 4, 5, 6 và 7 Điều này tính cả ngày nghỉ lễ, tết, ngày nghỉ hằng tuần.  \n**Điều 54. Chế độ thai sản của lao động nữ mang thai hộ**  \n1. Lao động nữ mang thai hộ được nghỉ việc hưởng chế độ thai sản khi khám thai theo quy định tại Điều 51 của Luật này.  \n2. Lao động nữ mang thai hộ khi sảy thai, phá thai hoặc có thai chết trong tử cung, thai chết trong khi chuyển dạ, thai ngoài tử cung được nghỉ việc hưởng chế độ thai sản theo quy định tại Điều 52 của Luật này.  \n3. Lao động nữ mang thai hộ khi sinh con mà có đủ điều kiện quy định tại khoản 2 hoặc khoản 3 Điều 50 của Luật này được:  \na) Nghỉ việc hưởng chế độ thai sản cho đến thời điểm giao đứa trẻ cho bên nhờ mang thai hộ nhưng không vượt quá thời gian quy định tại khoản 1 Điều 53 của Luật này.  \nTrong trường hợp kể từ ngày sinh đến thời điểm giao đứa trẻ mà thời gian hưởng chế độ thai sản chưa đủ 60 ngày thì lao động nữ mang thai hộ vẫn được hưởng chế độ thai sản cho đến khi đủ 60 ngày tính cả ngày nghỉ lễ, tết, ngày nghỉ hằng tuần. Thời điểm giao đứa trẻ cho bên nhờ mang thai hộ là thời điểm ghi trong văn bản xác nhận thời điểm giao đứa trẻ của bên nhờ mang thai hộ và bên mang thai hộ.  \nTrường hợp trước thời điểm giao nếu đứa trẻ chết mà thời gian hưởng chế độ thai sản chưa đủ 60 ngày thì lao động nữ mang thai hộ vẫn được hưởng chế độ thai sản cho đến khi đủ 60 ngày tính cả ngày nghỉ lễ, tết, ngày nghỉ hằng tuần;\nTrường hợp trước thời điểm giao nếu đứa trẻ chết mà thời gian hưởng chế độ thai sản chưa đủ 60 ngày thì lao động nữ mang thai hộ vẫn được hưởng chế độ thai sản cho đến khi đủ 60 ngày tính cả ngày nghỉ lễ, tết, ngày nghỉ hằng tuần;  \nb) Trong khoảng thời gian 30 ngày đầu kể từ ngày hết thời hạn hưởng chế độ thai sản quy định tại khoản 2 Điều này và điểm a khoản này mà sức khỏe chưa phục hồi thì lao động nữ mang thai hộ được nghỉ dưỡng sức, phục hồi sức khỏe theo quy định tại Điều 60 của Luật này, trừ trường hợp lao động nữ mang thai hộ chấm dứt hợp đồng lao động, hợp đồng làm việc hoặc thôi việc trước thời điểm sinh con.  \n4. Khi lao động nữ mang thai hộ sinh con thì người chồng đang tham gia bảo hiểm xã hội bắt buộc được nghỉ việc hưởng chế độ thai sản theo quy định tại khoản 2 và khoản 3 Điều 53 của Luật này.', '## Mục 2. CHẾ ĐỘ THAI SẢN**  \n### Điều 50.Đối tượng và điều kiện hưởng chế độ thai sản**  \n1. Đối tượng quy định tại các điểm a, b, c, d, i, k, l, m và n khoản 1 và khoản 2 Điều 2 của Luật này được hưởng chế độ thai sản khi thuộc một trong các trường hợp sau đây:  \na) Lao động nữ mang thai;  \nb) Lao động nữ sinh con;  \nc) Lao động nữ mang thai hộ;  \nd) Lao động nữ nhờ mang thai hộ;  \nđ) Người lao động nhận nuôi con nuôi dưới 06 tháng tuổi;  \ne) Người lao động sử dụng các biện pháp tránh thai mà các biện pháp đó phải được thực hiện tại cơ sở khám bệnh, chữa bệnh;  \ng) Lao động nam đang tham gia bảo hiểm xã hội bắt buộc có vợ sinh con, vợ mang thai hộ sinh con.  \n2. Đối tượng quy định tại các điểm b, c, d và đ khoản 1 Điều này phải đóng bảo hiểm xã hội bắt buộc từ đủ 06 tháng trở lên trong thời gian 12 tháng liền kề trước khi sinh con hoặc nhận con khi nhờ mang thai hộ hoặc nhận nuôi con nuôi dưới 06 tháng tuổi.  \n3. Đối tượng quy định tại điểm b và điểm c khoản 1 Điều này đã đóng bảo hiểm xã hội bắt buộc từ đủ 12 tháng trở lên mà khi mang thai phải nghỉ việc để dưỡng thai theo chỉ định của người hành nghề khám bệnh, chữa bệnh thuộc cơ sở khám bệnh, chữa bệnh thì phải đóng bảo hiểm xã hội bắt buộc từ đủ 03 tháng trở lên trong thời gian 12 tháng liền kề trước khi sinh con.  \n4. Đối tượng đủ điều kiện quy định tại khoản 2 hoặc khoản 3 hoặc khoản 5 Điều này mà chấm dứt hợp đồng lao động, hợp đồng làm việc hoặc thôi việc trước thời điểm sinh con hoặc nhận con khi nhờ mang thai hộ hoặc nhận nuôi con nuôi dưới 06 tháng tuổi thì vẫn được hưởng chế độ thai sản theo quy định tại các điều 53, 54, 55 và 56 và các khoản 1, 2 và 3 Điều 58 của Luật này. Thời gian hưởng chế độ thai sản không được tính là thời gian đóng bảo hiểm xã hội.  \n5. Đối tượng quy định tại điểm b khoản 1 Điều này đã đóng bảo hiểm xã hội bắt buộc từ đủ 06 tháng trở lên trong thời gian 24 tháng liền kề trước khi sinh con đối với trường hợp phải nghỉ việc để điều trị vô sinh.', '### Điều 140.Bảo đảm việc làm cho lao động nghỉ thai sản**  \nLao động được bảo đảm việc làm cũ khi trở lại làm việc sau khi nghỉ hết thời gian theo quy định tại các khoản 1, 3 và 5 Điều 139 của Bộ luật này mà không bị cắt giảm tiền lương và quyền, lợi ích so với trước khi nghỉ thai sản; trường hợp việc làm cũ không còn thì người sử dụng lao động phải bố trí việc làm khác cho họ với mức lương không thấp hơn mức lương trước khi nghỉ thai sản.']","[TƯ_VẤN]  
1. Trả lời trực tiếp: Lao động nữ sinh con được nghỉ thai sản tổng cộng 6 tháng, trong đó thời gian nghỉ trước khi sinh không quá 2 tháng. Nếu sinh đôi trở lên, từ con thứ 2 trở đi, mỗi con được nghỉ thêm 1 tháng. Ngoài ra, sau khi hết thời gian nghỉ thai sản theo quy định, nếu có nhu cầu, lao động nữ có thể thỏa thuận nghỉ thêm thời gian không hưởng lương với người sử dụng lao động. Trong trường hợp lao động nữ trở lại làm việc trước khi hết thời gian nghỉ thai sản nhưng đã nghỉ ít nhất 4 tháng, phải có sự đồng ý của người sử dụng lao động và xác nhận của cơ sở y tế về việc đi làm sớm không ảnh hưởng sức khỏe, lao động nữ vẫn được hưởng trợ cấp thai sản theo quy định.  

2. Cơ sở pháp lý:  
- Theo Khoản 1 Điều 139 Bộ luật Lao động 2019: ""Lao động nữ được nghỉ thai sản trước và sau khi sinh con là 06 tháng; thời gian nghỉ trước khi sinh không quá 02 tháng. Trường hợp lao động nữ sinh đôi trở lên thì tính từ con thứ 02 trở đi, cứ mỗi con, người mẹ được nghỉ thêm 01 tháng.""  
- Theo Khoản 3 và 4 Điều 139 Bộ luật Lao động 2019 quy định về nghỉ thêm không hưởng lương và điều kiện trở lại làm việc sớm.  
- Theo Khoản 1 Điều 53 Luật Bảo hiểm xã hội 2024, thời gian nghỉ việc hưởng chế độ thai sản của lao động nữ khi sinh con thực hiện theo quy định tại khoản 1 Điều 139 Bộ luật Lao động 2019.  

Bạn có thể yên tâm rằng quyền lợi nghỉ thai sản của lao động nữ được pháp luật bảo vệ rõ ràng và đầy đủ. Nếu cần hỗ trợ thêm về thủ tục hưởng chế độ hoặc các quyền lợi liên quan, bạn có thể hỏi thêm để được tư vấn chi tiết.","Theo khoản 1 Điều 139 Bộ luật Lao động 2019, lao động nữ được nghỉ thai sản trước và sau khi sinh con là 06 tháng.",0.999999999975,1.0,0.9090909090909091,0.8099774362979778
Người lao động làm thêm giờ vào ban đêm ngày lễ được trả lương như thế nào?,"['### Điều 98.Tiền lương làm thêm giờ, làm việc vào ban đêm**  \n1. Người lao động làm thêm giờ được trả lương tính theo đơn giá tiền lương hoặc tiền lương thực trả theo công việc đang làm như sau:  \na) Vào ngày thường, ít nhất bằng 150%;  \nb) Vào ngày nghỉ hằng tuần, ít nhất bằng 200%;  \nc) Vào ngày nghỉ lễ, tết, ngày nghỉ có hưởng lương, ít nhất bằng 300% chưa kể tiền lương ngày lễ, tết, ngày nghỉ có hưởng lương đối với người lao động hưởng lương ngày.  \n2. Người lao động làm việc vào ban đêm thì được trả thêm ít nhất bằng 30% tiền lương tính theo đơn giá tiền lương hoặc tiền lương thực trả theo công việc của ngày làm việc bình thường.  \n3. Người lao động làm thêm giờ vào ban đêm thì ngoài việc trả lương theo quy định tại khoản 1 và khoản 2 Điều này, người lao động còn được trả thêm 20% tiền lương tính theo đơn giá tiền lương hoặc tiền lương theo công việc làm vào ban ngày của ngày làm việc bình thường hoặc của ngày nghỉ hằng tuần hoặc của ngày nghỉ lễ, tết.  \n4. Chính phủ quy định chi tiết Điều này.', '### Điều 57.Tiền lương làm thêm giờ vào ban đêm**  \nNgười lao động làm thêm giờ vào ban đêm theo khoản 3 Điều 98 của Bộ luật Lao động, được hưởng tiền lương tính theo công thức sau:  \n1. Đối với người lao động hưởng lương theo thời gian, tiền lương làm thêm giờ vào ban đêm được tính như sau:  \n|Tiền<br>lương<br>làm<br>thêm<br>=|Tiền lương<br>giờ thực trả<br>của công<br>việc đang<br>x<br>Mức ít<br>nhất<br>150%<br>hoặc<br>+<br>Tiền<br>lương giờ<br>thực trả<br>của công<br>x<br>Mức<br>ít<br>nhất<br>+<br>20<br>%x<br>Tiền lương giờ<br>vào ban ngày<br>của ngày làm<br>việc bình|<br>x<br>Số<br>giờ<br>làm<br>thêm|\n|---|---|---|  \n|giờ vào<br>ban<br>đêm|làm vào<br>ngày làm<br>việc bình<br>thường<br>200%<br>hoặc<br>300%<br>việc đang<br>làm vào<br>ngày làm<br>việc bình<br>thường<br>30%<br>thường hoặc<br>của ngày nghỉ<br>hằng tuần<br>hoặc của ngày<br>nghỉ lễ, tết,<br>ngày nghỉ có<br>hưởng lương|vào<br>ban<br>đêm|\n|---|---|---|  \nTrong đó:  \na) Tiền lương giờ thực trả của công việc đang làm vào ngày làm việc bình thường được xác định theo điểm a khoản 1 Điều 55 Nghị định này;  \nb) Tiền lương giờ vào ban ngày của ngày làm việc bình thường hoặc của ngày nghỉ hằng tuần hoặc của ngày nghỉ lễ, tết, ngày nghỉ có hưởng lương được xác định như sau:  \nb1) Tiền lương giờ vào ban ngày của ngày làm việc bình thường, được tính ít nhất bằng 100% so với tiền lương giờ thực trả của công việc đang làm vào ngày làm việc bình thường đối với trường hợp người lao động không làm thêm giờ vào ban ngày của ngày đó (trước khi làm thêm giờ vào ban đêm); ít nhất bằng 150% so với tiền lương giờ thực trả của công việc đang làm vào ngày làm việc bình thường đối với trường hợp người lao động có làm thêm giờ vào ban ngày của ngày đó (trước khi làm thêm giờ vào ban đêm);  \nb2) Tiền lương giờ vào ban ngày của ngày nghỉ hằng tuần, được tính ít nhất bằng 200% so với tiền lương giờ thực trả của công việc đang làm vào ngày làm việc bình thường;\nb2) Tiền lương giờ vào ban ngày của ngày nghỉ hằng tuần, được tính ít nhất bằng 200% so với tiền lương giờ thực trả của công việc đang làm vào ngày làm việc bình thường;  \nb3) Tiền lương giờ vào ban ngày của ngày nghỉ lễ, tết, ngày nghỉ có hưởng lương, được tính ít nhất bằng 300% so với tiền lương giờ thực trả của công việc đang làm vào ngày làm việc bình thường.  \n2. Đối với người lao động hưởng lương theo sản phẩm, tiền lương làm thêm giờ vào ban đêm được tính như sau:  \n|Tiền<br>lương<br>làm<br>thêm<br>giờ<br>vào<br>ban<br>đêm<br>=|Đơn giá<br>tiền<br>lương<br>sản<br>phẩm<br>của ngày<br>làm việc<br>bình<br>thường<br>x<br>Mức ít<br>nhất<br>150%<br>hoặc<br>200%<br>hoặc<br>300%<br>+<br>Đơn giá<br>tiền lương<br>sản phẩm<br>của ngày<br>làm việc<br>bình<br>thường<br>x<br>Mức<br>ít<br>nhất<br>30%<br>+ 20% x<br>Đơn giá tiền<br>lương sản phẩm<br>vào ban ngày của<br>ngày làm việc<br>bình thường hoặc<br>của ngày nghỉ<br>hằng tuần hoặc<br>của ngày nghỉ lễ,<br>tết, ngày nghỉ có<br>hưởng lương|x<br>Số sản<br>phẩm<br>làm<br>thêm<br>vào<br>ban<br>đêm|\n|---|---|---|  \nTrong đó, đơn giá tiền lương sản phẩm vào ban ngày của ngày làm việc bình thường hoặc của ngày nghỉ hằng tuần hoặc của ngày nghỉ lễ, tết, ngày nghỉ có hưởng lương được xác định như sau:  \na) Đơn giá tiền lương sản phẩm vào ban ngày của ngày làm việc bình thường, được tính ít nhất bằng 100% so với đơn giá tiền lương sản phẩm của ngày làm việc bình thường đối với trường hợp người lao động không làm thêm giờ vào ban ngày của ngày đó (trước khi làm thêm giờ vào ban đêm); ít nhất bằng 150% so với đơn giá tiền lương sản phẩm của ngày làm việc bình thường đối với trường hợp người lao động có làm thêm giờ vào ban ngày của ngày đó (trước khi làm thêm giờ vào ban đêm);  \nb) Đơn giá tiền lương sản phẩm vào ban ngày của ngày nghỉ hằng tuần, được tính ít nhất bằng 200% so với đơn giá tiền lương sản phẩm của ngày làm việc bình thường;\nb) Đơn giá tiền lương sản phẩm vào ban ngày của ngày nghỉ hằng tuần, được tính ít nhất bằng 200% so với đơn giá tiền lương sản phẩm của ngày làm việc bình thường;  \nc) Đơn giá tiền lương sản phẩm vào ban ngày của ngày nghỉ lễ, tết, ngày nghỉ có hưởng lương, được tính ít nhất 300% so với đơn giá tiền lương sản phẩm của ngày làm việc bình thường.', '### Điều 56.Tiền lương làm việc vào ban đêm**  \nTiền lương làm việc vào ban đêm theo khoản 2 Điều 98 của Bộ luật Lao động, được tính theo công thức sau:  \n1. Đối với người lao động hưởng lương theo thời gian, tiền lương làm việc vào ban đêm được tính như sau:  \n|Tiền<br>lương<br>làm việc<br>vào ban<br>đêm<br>=|Tiền lương giờ thực<br>trả của công việc<br>đang làm vào ngày<br>làm việc bình thường<br>+<br>Tiền lương giờ<br>thực trả của công<br>việc đang làm vào<br>ngày làm việc bình<br>thường<br>x<br>Mức ít nhất<br>30%|x<br>Số giờ<br>làm việc<br>vào ban<br>đêm|\n|---|---|---|  \nTrong đó: Tiền lương giờ thực trả của công việc đang làm vào ngày làm việc bình thường được xác định theo điểm a khoản 1 Điều 55 Nghị định này.  \n2. Đối với người lao động hưởng lương theo sản phẩm, tiền lương làm việc vào ban đêm được tính như sau:  \n|Tiền lương<br>làm việc<br>vào ban<br>đêm<br>=<br>|Đơn giá tiền<br>lương sản<br>phẩm của ngày<br>làm việc bình<br>thường<br>+<br>Đơn giá tiền<br>lương sản phẩm<br>của ngày làm<br>việc bình thường<br>x<br>Mức ít<br>nhất<br>30%<br>|x<br>Số sản<br>phẩm làm<br>vào ban<br>đêm|\n|---|---|---|', '### Điều 55.Tiền lương làm thêm giờ**  \nTiền lương làm thêm giờ theo khoản 1 Điều 98 của Bộ luật Lao động được quy định như sau:  \n1. Đối với người lao động hưởng lương theo thời gian, được trả lương làm thêm giờ khi làm việc ngoài thời giờ làm việc bình thường do người sử dụng lao động quy định theo Điều 105 của Bộ luật Lao động và được tính theo công thức sau:  \n**==> picture [464 x 35] intentionally omitted <==**', '### Điều 106.Giờ làm việc ban đêm**  \nGiờ làm việc ban đêm được tính từ 22 giờ đến 06 giờ sáng ngày hôm sau.']","[TƯ_VẤN]

1. Trả lời trực tiếp:  
Người lao động làm thêm giờ vào ban đêm ngày lễ được trả lương theo công thức đặc biệt, bao gồm:  
- Tiền lương làm thêm giờ vào ngày lễ ít nhất bằng 300% so với tiền lương giờ thực trả của công việc đang làm vào ngày làm việc bình thường (theo khoản 1 Điều 98 Bộ luật Lao động 2019).  
- Tiền lương làm việc vào ban đêm được trả thêm ít nhất 30% tiền lương giờ thực trả của công việc đang làm vào ngày làm việc bình thường (khoản 2 Điều 98).  
- Ngoài ra, người lao động còn được trả thêm 20% tiền lương tính theo đơn giá tiền lương hoặc tiền lương theo công việc làm vào ban ngày của ngày lễ (khoản 3 Điều 98).  

Tổng hợp lại, tiền lương làm thêm giờ vào ban đêm ngày lễ được tính theo công thức tại Điều 57 Bộ luật Lao động 2019, cụ thể:  
Tiền lương làm thêm giờ vào ban đêm = (Tiền lương giờ thực trả x mức ít nhất 300%) + (Tiền lương giờ thực trả x mức ít nhất 30%) + (Tiền lương giờ thực trả x 20%) x số giờ làm thêm vào ban đêm ngày lễ.

2. Cơ sở pháp lý:  
- Theo khoản 1, khoản 2 và khoản 3 Điều 98 Bộ luật Lao động 2019 về tiền lương làm thêm giờ, làm việc vào ban đêm;  
- Theo Điều 57 Nghị định hướng dẫn về tiền lương làm thêm giờ vào ban đêm;  
- Theo Điều 106 Bộ luật Lao động 2019 về giờ làm việc ban đêm (từ 22 giờ đến 6 giờ sáng ngày hôm sau).  

Như vậy, người lao động làm thêm giờ vào ban đêm ngày lễ được hưởng mức lương rất ưu đãi, đảm bảo quyền lợi theo quy định pháp luật.","Được trả ít nhất 300% lương ngày lễ, cộng thêm 30% lương làm đêm, cộng thêm 20% tiền lương tính theo đơn giá tiền lương hoặc tiền lương thực trả theo công việc làm vào ban ngày của ngày làm việc bình thường hoặc của ngày nghỉ hằng tuần hoặc của ngày nghỉ lễ, tết.",0.999999999975,1.0,1.0,0.804874502393966
"Thử việc tối đa bao nhiêu ngày đối với công việc có chức danh nghề nghiệp cần trình độ chuyên môn, kỹ thuật từ cao đẳng trở lên?","['### Điều 25.Thời gian thử việc**  \nThời gian thử việc do hai bên thỏa thuận căn cứ vào tính chất và mức độ phức tạp của công việc nhưng chỉ được thử việc một lần đối với một công việc và bảo đảm điều kiện sau đây:  \n1. Không quá 180 ngày đối với công việc của người quản lý doanh nghiệp theo quy định của Luật Doanh nghiệp, Luật Quản lý, sử dụng vốn nhà nước đầu tư vào sản xuất, kinh doanh tại doanh nghiệp;  \n2. Không quá 60 ngày đối với công việc có chức danh nghề nghiệp cần trình độ chuyên môn, kỹ thuật từ cao đẳng trở lên;  \n3. Không quá 30 ngày đối với công việc có chức danh nghề nghiệp cần trình độ chuyên môn, kỹ thuật trung cấp, công nhân kỹ thuật, nhân viên nghiệp vụ;  \n4. Không quá 06 ngày làm việc đối với công việc khác.', '### Điều 26.Tiền lương thử việc**  \nTiền lương của người lao động trong thời gian thử việc do hai bên thỏa thuận nhưng ít nhất phải bằng 85% mức lương của công việc đó.', '### Điều 65.Thời gian được coi là thời gian làm việc để tính số ngày nghỉ hằng năm của người lao động**  \n1. Thời gian học nghề, tập nghề theo quy định tại Điều 61 của Bộ luật Lao động nếu sau khi hết thời gian học nghề, tập nghề mà người lao động làm việc cho người sử dụng lao động.  \n2. Thời gian thử việc nếu người lao động tiếp tục làm việc cho người sử dụng lao động sau khi hết thời gian thử việc.  \n3. Thời gian nghỉ việc riêng có hưởng lương theo khoản 1 Điều 115 của Bộ luật Lao động.  \n4. Thời gian nghỉ việc không hưởng lương nếu được người sử dụng lao động đồng ý nhưng cộng dồn không quá 01 tháng trong một năm.  \n5. Thời gian nghỉ do tai nạn lao động, bệnh nghề nghiệp nhưng cộng dồn không quá 6 tháng.  \n6. Thời gian nghỉ do ốm đau nhưng cộng dồn không quá 02 tháng trong một năm.  \n7. Thời gian nghỉ hưởng chế độ thai sản theo quy định của pháp luật về bảo hiểm xã hội.  \n8. Thời gian thực hiện các nhiệm vụ của tổ chức đại diện người lao động tại cơ sở mà được tính là thời gian làm việc theo quy định của pháp luật.  \n9. Thời gian phải ngừng việc, nghỉ việc không do lỗi của người lao động.  \n10. Thời gian nghỉ vì bị tạm đình chỉ công việc nhưng sau đó được kết luận là không vi phạm hoặc không bị xử lý kỷ luật lao động.', '### Điều 36.Quyền đơn phương chấm dứt hợp đồng lao động của người sử dụng lao động**  \n1. Người sử dụng lao động có quyền đơn phương chấm dứt hợp đồng lao động trong trường hợp sau đây:  \na) Người lao động thường xuyên không hoàn thành công việc theo hợp đồng lao động được xác định theo tiêu chí đánh giá mức độ hoàn thành công việc trong quy chế của người sử dụng lao động. Quy chế đánh giá mức độ hoàn thành công việc do người sử dụng lao động ban hành nhưng phải tham khảo ý kiến tổ chức đại diện người lao động tại cơ sở đối với nơi có tổ chức đại diện người lao động tại cơ sở;  \nb) Người lao động bị ốm đau, tai nạn đã điều trị 12 tháng liên tục đối với người làm việc theo hợp đồng lao động không xác định thời hạn hoặc đã điều trị 06 tháng liên tục đối với người làm việc theo hợp đồng lao động xác định thời hạn có thời hạn từ 12 tháng đến 36 tháng hoặc quá nửa thời hạn hợp đồng lao động đối với người làm việc theo hợp đồng lao động xác định thời hạn có thời hạn dưới 12 tháng mà khả năng lao động chưa hồi phục.  \nKhi sức khỏe của người lao động bình phục thì người sử dụng lao động xem xét để tiếp tục giao kết hợp đồng lao động với người lao động;  \nc) Do thiên tai, hỏa hoạn, dịch bệnh nguy hiểm, địch họa hoặc di dời, thu hẹp sản xuất, kinh doanh theo yêu cầu của cơ quan nhà nước có thẩm quyền mà người sử dụng lao động đã tìm mọi biện pháp khắc phục nhưng vẫn buộc phải giảm chỗ làm việc;  \nd) Người lao động không có mặt tại nơi làm việc sau thời hạn quy định tại Điều 31 của Bộ luật này;  \nđ) Người lao động đủ tuổi nghỉ hưu theo quy định tại Điều 169 của Bộ luật này, trừ trường hợp có thỏa thuận khác;  \ne) Người lao động tự ý bỏ việc mà không có lý do chính đáng từ 05 ngày làm việc liên tục trở lên;  \ng) Người lao động cung cấp không trung thực thông tin theo quy định tại khoản 2 Điều 16 của Bộ luật này khi giao kết hợp đồng lao động làm ảnh hưởng đến việc tuyển dụng người lao động.\ne) Người lao động tự ý bỏ việc mà không có lý do chính đáng từ 05 ngày làm việc liên tục trở lên;  \ng) Người lao động cung cấp không trung thực thông tin theo quy định tại khoản 2 Điều 16 của Bộ luật này khi giao kết hợp đồng lao động làm ảnh hưởng đến việc tuyển dụng người lao động.  \n2. Khi đơn phương chấm dứt hợp đồng lao động trong trường hợp quy định tại các điểm a, b, c, đ và g khoản 1 Điều này, người sử dụng lao động phải báo trước cho người lao động như sau:  \na) Ít nhất 45 ngày đối với hợp đồng lao động không xác định thời hạn;  \nb) Ít nhất 30 ngày đối với hợp đồng lao động xác định thời hạn có thời hạn từ 12 tháng đến 36 tháng;  \nc) Ít nhất 03 ngày làm việc đối với hợp đồng lao động xác định thời hạn có thời hạn dưới 12 tháng và đối với trường hợp quy định tại điểm b khoản 1 Điều này;  \nd) Đối với một số ngành, nghề, công việc đặc thù thì thời hạn báo trước được thực hiện theo quy định của Chính phủ.  \n3. Khi đơn phương chấm dứt hợp đồng lao động quy định tại điểm d và điểm e khoản 1 Điều này thì người sử dụng lao động không phải báo trước cho người lao động.', '### Điều 125.Áp dụng hình thức xử lý kỷ luật sa thải**  \nHình thức xử lý kỷ luật sa thải được người sử dụng lao động áp dụng trong trường hợp sau đây:  \n1. Người lao động có hành vi trộm cắp, tham ô, đánh bạc, cố ý gây thương tích, sử dụng ma túy tại nơi làm việc;  \n2. Người lao động có hành vi tiết lộ bí mật kinh doanh, bí mật công nghệ, xâm phạm quyền sở hữu trí tuệ của người sử dụng lao động, có hành vi gây thiệt hại nghiêm trọng hoặc đe dọa gây thiệt hại đặc biệt nghiêm trọng về tài sản, lợi ích của người sử dụng lao động hoặc quấy rối tình dục tại nơi làm việc được quy định trong nội quy lao động;  \n3. Người lao động bị xử lý kỷ luật kéo dài thời hạn nâng lương hoặc cách chức mà tái phạm trong thời gian chưa xóa kỷ luật. Tái phạm là trường hợp người lao động lặp lại hành vi vi phạm đã bị xử lý kỷ luật mà chưa được xóa kỷ luật theo quy định tại Điều 126 của Bộ luật này;  \n4. Người lao động tự ý bỏ việc 05 ngày cộng dồn trong thời hạn 30 ngày hoặc 20 ngày cộng dồn trong thời hạn 365 ngày tính từ ngày đầu tiên tự ý bỏ việc mà không có lý do chính đáng.  \nTrường hợp được coi là có lý do chính đáng bao gồm thiên tai, hỏa hoạn, bản thân, thân nhân bị ốm có xác nhận của cơ sở khám bệnh, chữa bệnh có thẩm quyền và trường hợp khác được quy định trong nội quy lao động.']","[TƯ_VẤN]  
1. Trả lời trực tiếp: Thời gian thử việc tối đa đối với công việc có chức danh nghề nghiệp cần trình độ chuyên môn, kỹ thuật từ cao đẳng trở lên là không quá 60 ngày.  
2. Cơ sở pháp lý: Theo Khoản 2 Điều 25 Bộ luật Lao động 2019 quy định về thời gian thử việc: ""Không quá 60 ngày đối với công việc có chức danh nghề nghiệp cần trình độ chuyên môn, kỹ thuật từ cao đẳng trở lên.""","Không quá 60 ngày đối với công việc có chức danh nghề nghiệp cần trình độ chuyên môn, kỹ thuật từ cao đẳng trở lên theo Điều 27 Bộ luật Lao động 2019.",0.9999999999,0.5,1.0,0.7848635212719519
Bao nhiêu tuổi thì được coi là người lao động cao tuổi?,"['## Mục 2. NGƯỜI LAO ĐỘNG CAO TUỔI**  \n### Điều 148.Người lao động cao tuổi**  \n1. Người lao động cao tuổi là người tiếp tục lao động sau độ tuổi theo quy định tại khoản 2 Điều 169 của Bộ luật này.  \n2. Người lao động cao tuổi có quyền thỏa thuận với người sử dụng lao động về việc rút ngắn thời giờ làm việc hằng ngày hoặc áp dụng chế độ làm việc không trọn thời gian.  \n3. Nhà nước khuyến khích sử dụng người lao động cao tuổi làm việc phù hợp với sức khỏe để bảo đảm quyền lao động và sử dụng hiệu quả nguồn nhân lực.', '### Điều 169.Tuổi nghỉ hưu**  \n1. Người lao động bảo đảm điều kiện về thời gian đóng bảo hiểm xã hội theo quy định của pháp luật về bảo hiểm xã hội được hưởng lương hưu khi đủ tuổi nghỉ hưu.  \n2. Tuổi nghỉ hưu của người lao động trong điều kiện lao động bình thường được điều chỉnh theo lộ trình cho đến khi đủ 62 tuổi đối với lao động nam vào năm 2028 và đủ 60 tuổi đối với lao động nữ vào năm 2035.  \nKể từ năm 2021, tuổi nghỉ hưu của người lao động trong điều kiện lao động bình thường là đủ 60 tuổi 03 tháng đối với lao động nam và đủ 55 tuổi 04 tháng đối với lao động nữ; sau đó, cứ mỗi năm tăng thêm 03 tháng đối với lao động nam và 04 tháng đối với lao động nữ.  \n3. Người lao động bị suy giảm khả năng lao động; làm nghề, công việc đặc biệt nặng nhọc, độc hại, nguy hiểm; làm nghề, công việc nặng nhọc, độc hại, nguy hiểm; làm việc ở vùng có điều kiện kinh tế - xã hội đặc biệt khó khăn có thể nghỉ hưu ở tuổi thấp hơn nhưng không quá 05 tuổi so với quy định tại khoản 2 Điều này tại thời điểm nghỉ hưu, trừ trường hợp pháp luật có quy định khác.  \n4. Người lao động có trình độ chuyên môn, kỹ thuật cao và một số trường hợp đặc biệt có thể nghỉ hưu ở tuổi cao hơn nhưng không quá 05 tuổi so với quy định tại khoản 2 Điều này tại thời điểm nghỉ hưu, trừ trường hợp pháp luật có quy định khác.  \n5. Chính phủ quy định chi tiết Điều này.', '### Điều 149.Sử dụng người lao động cao tuổi**  \n1. Khi sử dụng người lao động cao tuổi, hai bên có thể thỏa thuận giao kết nhiều lần hợp đồng lao động xác định thời hạn.  \n2. Khi người lao động cao tuổi đang hưởng lương hưu theo quy định của Luật Bảo hiểm xã hội mà làm việc theo hợp đồng lao động mới thì ngoài quyền lợi đang hưởng theo chế độ hưu trí, người lao động cao tuổi được hưởng tiền lương và các quyền lợi khác theo quy định của pháp luật, hợp đồng lao động.  \n3. Không được sử dụng người lao động cao tuổi làm nghề, công việc nặng nhọc, độc hại, nguy hiểm hoặc đặc biệt nặng nhọc, độc hại, nguy hiểm có ảnh hưởng xấu tới sức khỏe người lao động cao tuổi, trừ trường hợp bảo đảm các điều kiện làm việc an toàn.  \n4. Người sử dụng lao động có trách nhiệm quan tâm chăm sóc sức khỏe của người lao động cao tuổi tại nơi làm việc.', '## Mục 2. CHẾ ĐỘ HƯU TRÍ**  \n### Điều 98.Đối tượng và điều kiện hưởng lương hưu**  \nNgười tham gia bảo hiểm xã hội tự nguyện được hưởng lương hưu khi đủ tuổi nghỉ hưu theo quy định tại khoản 2 Điều 169 của Bộ luật Lao động và có thời gian đóng bảo hiểm xã hội từ đủ 15 năm trở lên.', '## Mục 1. LAO ĐỘNG CHƯA THÀNH NIÊN**  \n### Điều 143.Lao động chưa thành niên**  \n1. Lao động chưa thành niên là người lao động chưa đủ 18 tuổi.  \n2. Người từ đủ 15 tuổi đến chưa đủ 18 tuổi không được làm công việc hoặc làm việc ở nơi làm việc quy định tại Điều 147 của Bộ luật này.  \n3. Người từ đủ 13 tuổi đến chưa đủ 15 tuổi chỉ được làm công việc nhẹ theo danh mục do Bộ trưởng Bộ Lao động - Thương binh và Xã hội ban hành.  \n4. Người chưa đủ 13 tuổi chỉ được làm các công việc theo quy định tại khoản 3 Điều 145 của Bộ luật này.']","[TƯ_VẤN]  
1. Trả lời trực tiếp: Người lao động cao tuổi là người tiếp tục lao động sau độ tuổi nghỉ hưu theo quy định tại khoản 2 Điều 169 Bộ luật Lao động 2019. Cụ thể, tuổi nghỉ hưu hiện tại được điều chỉnh theo lộ trình đến năm 2028 là đủ 62 tuổi đối với lao động nam và đến năm 2035 là đủ 60 tuổi đối với lao động nữ. Do đó, người lao động cao tuổi là người lao động nam từ trên 62 tuổi trở lên và người lao động nữ từ trên 60 tuổi trở lên (theo lộ trình điều chỉnh tuổi nghỉ hưu).  

2. Cơ sở pháp lý:  
- Theo khoản 1 Điều 148 Bộ luật Lao động 2019: ""Người lao động cao tuổi là người tiếp tục lao động sau độ tuổi theo quy định tại khoản 2 Điều 169 của Bộ luật này.""  
- Theo khoản 2 Điều 169 Bộ luật Lao động 2019: ""Tuổi nghỉ hưu của người lao động trong điều kiện lao động bình thường được điều chỉnh theo lộ trình cho đến khi đủ 62 tuổi đối với lao động nam vào năm 2028 và đủ 60 tuổi đối với lao động nữ vào năm 2035.""  
- Khoản 2 Điều 148 Bộ luật Lao động 2019 cũng quy định quyền của người lao động cao tuổi về thỏa thuận rút ngắn thời giờ làm việc hoặc làm việc không trọn thời gian.  

Bạn có thể dựa vào các quy định này để xác định tuổi nào được coi là người lao động cao tuổi theo pháp luật hiện hành.",Người lao động cao tuổi là người tiếp tục lao động sau độ tuổi nghỉ hưu theo quy định tại khoản 2 Điều 169 của Bộ luật Lao động.,0.9166666666361111,1.0,0.7272727272727273,0.7823924551508825
Người lao động đơn phương chấm dứt hợp đồng lao động không xác định thời hạn phải báo trước bao nhiêu ngày?,"['### Điều 35.Quyền đơn phương chấm dứt hợp đồng lao động của người lao động**  \n1. Người lao động có quyền đơn phương chấm dứt hợp đồng lao động nhưng phải báo trước cho người sử dụng lao động như sau:  \na) Ít nhất 45 ngày nếu làm việc theo hợp đồng lao động không xác định thời hạn;  \nb) Ít nhất 30 ngày nếu làm việc theo hợp đồng lao động xác định thời hạn có thời hạn từ 12 tháng đến 36 tháng;  \nc) Ít nhất 03 ngày làm việc nếu làm việc theo hợp đồng lao động xác định thời hạn có thời hạn dưới 12 tháng;  \nd) Đối với một số ngành, nghề, công việc đặc thù thì thời hạn báo trước được thực hiện theo quy định của Chính phủ.  \n2. Người lao động có quyền đơn phương chấm dứt hợp đồng lao động không cần báo trước trong trường hợp sau đây:  \na) Không được bố trí theo đúng công việc, địa điểm làm việc hoặc không được bảo đảm điều kiện làm việc theo thỏa thuận, trừ trường hợp quy định tại Điều 29 của Bộ luật này;  \nb) Không được trả đủ lương hoặc trả lương không đúng thời hạn, trừ trường hợp quy định tại khoản 4 Điều 97 của Bộ luật này;  \nc) Bị người sử dụng lao động ngược đãi, đánh đập hoặc có lời nói, hành vi nhục mạ, hành vi làm ảnh hưởng đến sức khỏe, nhân phẩm, danh dự; bị cưỡng bức lao động;  \nd) Bị quấy rối tình dục tại nơi làm việc;  \nđ) Lao động nữ mang thai phải nghỉ việc theo quy định tại khoản 1 Điều 138 của Bộ luật này;  \ne) Đủ tuổi nghỉ hưu theo quy định tại Điều 169 của Bộ luật này, trừ trường hợp các bên có thỏa thuận khác;  \ng) Người sử dụng lao động cung cấp thông tin không trung thực theo quy định tại khoản 1 Điều 16 của Bộ luật này làm ảnh hưởng đến việc thực hiện hợp đồng lao động.', '### Điều 40.Nghĩa vụ của người lao động khi đơn phương chấm dứt hợp đồng lao động trái pháp luật**  \n1. Không được trợ cấp thôi việc.  \n2. Phải bồi thường cho người sử dụng lao động nửa tháng tiền lương theo hợp đồng lao động và một khoản tiền tương ứng với tiền lương theo hợp đồng lao động trong những ngày không báo trước.  \n3. Phải hoàn trả cho người sử dụng lao động chi phí đào tạo quy định tại Điều 62 của Bộ luật này.', '### Điều 89.Một số quy định riêng đối với lao động là người giúp việc gia đình**  \n1. Quy định về hình thức hợp đồng lao động theo Điều 14 và khoản 1 Điều 162; nghĩa vụ cung cấp thông tin khi giao kết hợp đồng lao động theo Điều 16; nội dung hợp đồng lao động theo khoản 1 Điều 21; đơn phương chấm dứt hợp đồng lao động theo khoản 2 Điều 35, khoản 3 Điều 36 và khoản 2 Điều 162; nghĩa vụ khi đơn phương chấm dứt hợp đồng lao động trái pháp luật theo Điều 40, Điều 41; trợ cấp thôi việc theo Điều 46 của Bộ luật Lao động được thực hiện như sau:  \na) Khi nhận người lao động vào làm việc thì người sử dụng lao động phải ký kết hợp đồng lao động với người lao động. Hình thức hợp đồng lao động ký kết phải bằng văn bản theo quy định tại khoản 1 Điều 14 và khoản 1 Điều 162 của Bộ luật Lao động;  \nb) Trước khi ký kết hợp đồng lao động, người lao động và người sử dụng lao động có nghĩa vụ cung cấp thông tin theo quy định tại Điều 16 của Bộ luật Lao động, đồng thời người sử dụng lao động phải cung cấp rõ các thông tin về phạm vi công việc phải làm, điều kiện ăn, ở của người lao động tại gia đình người sử dụng lao động và những thông tin cần thiết khác liên quan đến việc bảo đảm an toàn sức khỏe trong việc thực hiện công việc mà người lao động yêu cầu;  \nc) Nội dung hợp đồng lao động theo quy định tại khoản 1 Điều 21 của Bộ luật Lao động. Căn cứ Mẫu số 01/PLV Phụ lục V ban hành kèm theo Nghị định này, người sử dụng lao động và người lao động có trách nhiệm thỏa thuận cụ thể các quyền, nghĩa vụ và lợi ích của mỗi bên trong hợp đồng lao động để thực hiện phù hợp với điều kiện thực tế nhưng phải bảo đảm các nội dung chủ yếu quy định tại khoản 1 Điều 21 của Bộ luật Lao động;  \nd) Trong quá trình thực hiện hợp đồng lao động, mỗi bên có quyền đơn phương chấm dứt hợp đồng lao động mà không cần lý do nhưng phải báo trước ít nhất 15 ngày, trừ các trường hợp sau thì không phải báo trước:\nd) Trong quá trình thực hiện hợp đồng lao động, mỗi bên có quyền đơn phương chấm dứt hợp đồng lao động mà không cần lý do nhưng phải báo trước ít nhất 15 ngày, trừ các trường hợp sau thì không phải báo trước:  \nd1) Người lao động đơn phương chấm dứt hợp đồng lao động vì các lý do: Không được bố trí theo đúng công việc, địa điểm làm việc hoặc không được bảo đảm điều kiện làm việc theo thỏa thuận, trừ trường hợp quy định tại Điều 29 của Bộ luật Lao động; không được trả đủ lương hoặc trả lương không đúng thời hạn, trừ trường hợp quy định tại khoản 4 Điều 97 của Bộ luật Lao động; bị người sử dụng lao động ngược đãi, đánh đập hoặc có lời nói, hành vi nhục mạ, hành vi làm ảnh hưởng đến sức khỏe, nhân phẩm, danh dự; bị cưỡng bức lao động; bị quấy rối tình dục tại nơi làm việc; lao động nữ mang thai phải nghỉ việc theo quy định tại khoản 1 Điều 138 của Bộ luật Lao động; đủ tuổi nghỉ hưu theo quy định tại Điều 169 của Bộ luật Lao động trừ trường hợp các bên có thỏa thuận khác; người sử dụng lao động cung cấp thông tin không trung thực theo quy định tại khoản 1 Điều 16 của Bộ luật Lao động làm ảnh hưởng đến việc thực hiện hợp đồng lao động;  \nd2) Người sử dụng lao động đơn phương chấm dứt hợp đồng lao động vì các lý do: Người lao động không có mặt tại nơi làm việc sau thời hạn quy định tại Điều 31 của Bộ luật Lao động; người lao động tự ý bỏ việc mà không có lý do chính đáng từ 05 ngày làm việc liên tục trở lên;  \nđ) Đơn phương chấm dứt hợp đồng lao động trái pháp luật là trường hợp đơn phương chấm dứt hợp đồng lao động không đúng quy định tại điểm d khoản này. Khi đơn phương chấm dứt hợp đồng lao động trái pháp luật thì người lao động có nghĩa vụ thực hiện quy định tại Điều 40, người sử dụng lao động có nghĩa vụ thực hiện quy định tại Điều 41 của Bộ luật Lao động. Trường hợp người sử dụng\nlao động vi phạm thời hạn báo trước theo điểm d khoản này thì phải trả cho người lao động một khoản tiền tương ứng với tiền lương theo hợp đồng lao động trong những ngày không báo trước;  \ne) Khi hợp đồng lao động chấm dứt theo quy định tại các khoản 1, 2, 3, 4, 6 và khoản 7 Điều 34 của Bộ luật Lao động và điểm d khoản này, người sử dụng lao động có trách nhiệm trả trợ cấp thôi việc cho người lao động theo quy định tại Điều 46 của Bộ luật Lao động; hai bên có trách nhiệm thanh toán đầy đủ các khoản tiền có liên quan đến quyền lợi của mỗi bên.  \n2. Người lao động và người sử dụng lao động thỏa thuận về tiền lương, thưởng và thực hiện trả lương, thưởng theo quy định tại Chương VI (trừ Điều 93) của Bộ luật Lao động, trong đó tiền lương của người lao động thỏa thuận trong hợp đồng lao động theo quy định tại khoản 1, khoản 2 Điều 90 của Bộ luật Lao động bao gồm mức lương theo công việc, phụ cấp lương và các khoản bổ sung khác nếu có. Mức lương theo công việc bao gồm cả chi phí tiền ăn, ở của người lao động tại gia đình người sử dụng lao động (nếu có) không được thấp hơn mức lương tối thiểu vùng do Chính phủ công bố. Người sử dụng lao động và người lao động thỏa thuận mức chi phí ăn, ở hằng tháng của người lao động (nếu có), tối đa không quá 50% mức lương theo công việc ghi trong hợp đồng lao động.  \n3. Thời giờ làm việc, thời giờ nghỉ ngơi thực hiện theo quy định tại Chương VII của Bộ luật Lao động và Chương VII Nghị định này, trong đó thời gian nghỉ ngơi trong ngày làm việc bình thường, ngày nghỉ hằng tuần được thực hiện như sau:  \na) Vào ngày làm việc bình thường, ngoài thời giờ làm việc thỏa thuận trong hợp đồng lao động theo quy định, người sử dụng lao động phải bảo đảm, tạo điều kiện cho người lao động được nghỉ ít nhất 8 giờ, trong đó có 6 giờ liên tục trong 24 giờ liên tục;\na) Vào ngày làm việc bình thường, ngoài thời giờ làm việc thỏa thuận trong hợp đồng lao động theo quy định, người sử dụng lao động phải bảo đảm, tạo điều kiện cho người lao động được nghỉ ít nhất 8 giờ, trong đó có 6 giờ liên tục trong 24 giờ liên tục;  \nb) Người lao động được nghỉ hằng tuần theo quy định tại Điều 111 của Bộ luật Lao động, trường hợp người sử dụng lao động không thể bố trí nghỉ hằng tuần thì phải bảo đảm cho người lao động được nghỉ tính bình quân 01 tháng ít nhất 04 ngày.  \n4. Người sử dụng lao động có trách nhiệm trả cùng lúc với kỳ trả lương cho người lao động một khoản tiền bằng mức đóng bảo hiểm xã hội bắt buộc, bảo hiểm y tế thuộc trách nhiệm của người sử dụng lao động theo quy định của pháp luật về bảo hiểm xã hội, bảo hiểm y tế để người lao động chủ động tham gia bảo hiểm xã hội, bảo hiểm y tế.  \nTrường hợp người lao động đồng thời giao kết nhiều hợp đồng lao động làm giúp việc gia đình thì trách nhiệm trả tiền bảo hiểm xã hội, bảo hiểm y tế của người sử dụng lao động được thực hiện theo từng hợp đồng lao động.  \n5. An toàn, vệ sinh lao động đối với lao động là người giúp việc gia đình được thực hiện như sau:  \na) Người sử dụng lao động có trách nhiệm hướng dẫn cách sử dụng máy, thiết bị, đồ dùng, các biện pháp phòng, chống cháy, nổ trong gia đình có liên quan đến công việc của người lao động; trang bị phương tiện bảo vệ cá nhân cho người lao động trong quá trình làm việc;  \nb) Khi người lao động bị tai nạn lao động, bệnh nghề nghiệp, người sử dụng lao động phải thực hiện các trách nhiệm đối với người lao động theo quy định tại Điều 38, Điều 39 của Luật An toàn, vệ sinh lao động;  \nc) Người lao động có trách nhiệm chấp hành đúng hướng dẫn sử dụng máy, thiết bị, đồ dùng và phòng, chống cháy, nổ; bảo đảm các yêu cầu vệ sinh môi trường của hộ gia đình, dân cư nơi cư trú.  \n6. Kỷ luật lao động, trách nhiệm vật chất đối với người lao động được thực hiện như sau:\nc) Người lao động có trách nhiệm chấp hành đúng hướng dẫn sử dụng máy, thiết bị, đồ dùng và phòng, chống cháy, nổ; bảo đảm các yêu cầu vệ sinh môi trường của hộ gia đình, dân cư nơi cư trú.  \n6. Kỷ luật lao động, trách nhiệm vật chất đối với người lao động được thực hiện như sau:  \na) Người sử dụng lao động và người lao động xác định cụ thể các hành vi, hình thức xử lý kỷ luật lao động, trách nhiệm vật chất theo quy định tại khoản 2 Điều 118 và Điều 129 của Bộ luật Lao động và ghi trong hợp đồng lao động hoặc thể hiện bằng hình thức thỏa thuận khác;  \nb) Hình thức xử lý kỷ luật lao động áp dụng đối với người lao động bao gồm khiển trách, sa thải theo khoản 1, khoản 4 Điều 124 của Bộ luật Lao động;  \nc) Hình thức xử lý kỷ luật sa thải được người sử dụng lao động áp dụng trong các trường hợp: Người lao động có hành vi vi phạm quy định tại các khoản 1, 2 và khoản 4 Điều 125 của Bộ luật Lao động hoặc người lao động có hành vi ngược đãi, đánh đập hoặc có lời nói, hành vi nhục mạ, hành vi làm ảnh hưởng đến sức khỏe, nhân phẩm, danh dự đối với người sử dụng lao động hoặc thành viên trong hộ gia đình;  \nd) Khi phát hiện người lao động có hành vi vi phạm kỷ luật lao động thì người sử dụng lao động xem xét, xử lý kỷ luật lao động theo hình thức quy định tại điểm b khoản này đối với người lao động. Trường hợp người lao động là người từ đủ 15 tuổi đến dưới 18 tuổi thì người sử dụng lao động phải thông báo việc xử lý kỷ luật lao động đến người đại diện theo pháp luật của người lao động;  \nđ) Việc xử lý kỷ luật lao động đối với người lao động phải bảo đảm các nguyên tắc, trình tự, thủ tục quy định tại điểm a, điểm c khoản 1, khoản 2, khoản 3, khoản 4 và khoản 5 Điều 122 của Bộ luật Lao động.', '### Điều 162.Hợp đồng lao động đối với lao động là người giúp việc gia đình**  \n1. Người sử dụng lao động phải giao kết hợp đồng lao động bằng văn bản với lao động là người giúp việc gia đình.  \n2. Thời hạn của hợp đồng lao động đối với lao động là người giúp việc gia đình do hai bên thỏa thuận. Một bên có quyền đơn phương chấm dứt hợp đồng lao động bất kỳ khi nào nhưng phải báo trước ít nhất 15 ngày.  \n3. Hai bên thỏa thuận trong hợp đồng lao động về hình thức trả lương, kỳ hạn trả lương, thời giờ làm việc hằng ngày, chỗ ở.']","[TƯ_VẤN]  
1. Trả lời trực tiếp: Người lao động đơn phương chấm dứt hợp đồng lao động không xác định thời hạn phải báo trước cho người sử dụng lao động ít nhất 45 ngày.  

2. Cơ sở pháp lý: Theo Khoản 1 Điều 35 Bộ luật Lao động 2019 quy định: ""Người lao động có quyền đơn phương chấm dứt hợp đồng lao động nhưng phải báo trước cho người sử dụng lao động như sau: a) Ít nhất 45 ngày nếu làm việc theo hợp đồng lao động không xác định thời hạn"".",Phải báo trước ít nhất 45 ngày theo quy định tại điểm a khoản 1 Điều 35 Bộ luật Lao động 2019.,0.9999999999,1.0,0.75,0.8104152148538749
